Product Name,Categories
Gkidz Boy's Vest,Clothing
GALLOWAY skinny Fit Women's Jeans,Clothing
AntiqueShop ABKL_GRN_GRN_GRN,CDs & Vinyl
AntiqueShop ABKL_PL_PNK_PNK,CDs & Vinyl
United Colors of Benetton Printed Round Neck T-Shirt,Clothing
AntiqueShop ABKL_PL_PL_PNK,CDs & Vinyl
Esteem Boy's Drawer,Home & Kitchen
Dremel 2615.023.132 Plastic Friction Work Bench Cabinet,Tools & Home Improvement
Bodycare Boy's Vest,Clothing
"Britex BT9026 Bluetec Bucherer Analog Watch  - For Boys, Men",Sports & Outdoors
StyloFashionGarments slim Fit Women's Jeans,Clothing
GINI & JONY Solid Baby Boy's Round Neck T-Shirt,Clothing
BagsHub Women Black PU Clutch,Accessories
Triveni Women Pink Rexine Sling Bag,Sports & Outdoors
Sanaa Creations Alloy Ring,"Arts, Crafts & Sewing"
ULTRAVISION Full Rim Round Frame,Home & Kitchen
brass gift center Showpiece  -  48 cm,Home & Kitchen
Zobello Slim Fit Men's Grey Trousers,Clothing
VINSON LONDON Full Rim Oval Frame,Home & Kitchen
Silvesto India Stone Pearl Silver Ring,Jewelry
"ABEEZ Boys, Men, Girls",Clothing
ColorPlus Slim Fit Men's Black Trousers,Clothing
Park Avenue Regular Fit Men's Brown Trousers,Clothing
PrettySecrets Women's,Clothing
Satynam Women's Nighty,Clothing
Squirrel Women's Nighty,Clothing
Nucode Graphic Print Men's Round Neck T-Shirt,Clothing
Oviyon Solid Men's Polo Neck T-Shirt,Clothing
Numero Uno Striped Men's Polo Neck T-Shirt,Clothing
Nucode Solid Men's V-neck T-Shirt,Clothing
Numero Uno Solid Men's V-neck T-Shirt,Clothing
Numero Uno Solid Men's Round Neck T-Shirt,Clothing
Oviyon Solid Men's Round Neck T-Shirt,Clothing
Oviyon Printed Men's Round Neck T-Shirt,Clothing
Orange and Orchid Solid Men's Polo T-Shirt,Clothing
Nuteez Solid Men's Round Neck T-Shirt,Clothing
"Nitlon Solid Men's Henley, Round Neck T-Shirt",Clothing
Okane Solid Men's Round Neck T-Shirt,Clothing
Ninja Turtles Printed Men's Round Neck T-Shirt,Clothing
Osho Fashion Concepts Printed Men's V-neck T-Shirt,Clothing
Ninja Turtles Printed Men's Polo T-Shirt,Clothing
Nirvana Printed Men's Round Neck T-Shirt,Clothing
Numero Uno Printed Men's Polo Neck T-Shirt,Clothing
Opiumstreet Printed Men's Round Neck T-Shirt,Clothing
Oviyon Solid Men's V-neck T-Shirt,Clothing
Okane Printed Men's Round Neck T-Shirt,Clothing
Northern Lights Striped Men's V-neck T-Shirt,Clothing
Nod'R Solid Men's Round Neck T-Shirt,Clothing
Numero Uno Printed Men's Round Neck T-Shirt,Clothing
Ocean 9 Striped Men's Polo T-Shirt,Clothing
Nimya Solid Men's Polo Neck T-Shirt,Clothing
Northern Lights Solid Men's Round Neck T-Shirt,Clothing
Oviyon Printed Men's V-neck T-Shirt,Clothing
Norwood Striped Men's Polo Neck T-Shirt,Clothing
Origin Thai Solid Men's V-neck T-Shirt,Clothing
Okane Striped Men's Polo Neck T-Shirt,Clothing
Nivia Solid Men's Round Neck T-Shirt,Clothing
OuttaSkin Striped Men's Polo Neck T-Shirt,Clothing
Northern Lights Solid Men's Polo Neck T-Shirt,Clothing
Ovl Graphic Print Men's Round Neck T-Shirt,Clothing
Okane Solid Men's Polo T-Shirt,Clothing
Onn Solid Men's Polo Neck T-Shirt,Clothing
Orange and Orchid Striped Men's Polo T-Shirt,Clothing
Numero Uno Printed Men's V-neck T-Shirt,Clothing
Outtaskin Striped Men's Round Neck T-Shirt,Clothing
Numero Uno Solid Men's Polo Neck T-Shirt,Clothing
Numero Uno Solid Men's Polo T-Shirt,Clothing
Origin Thai Printed Men's Round Neck T-Shirt,Clothing
Osberry Solid Men's Henley T-Shirt,Clothing
Orange Plum Printed Men's Round Neck T-Shirt,Clothing
Ninja Turtle Printed Men's Polo T-Shirt,Clothing
Ocean Race Graphic Print Men's Round Neck T-Shirt,Clothing
Ocean Race Solid Men's Round Neck T-Shirt,Clothing
Northern Lights Striped Men's Round Neck T-Shirt,Clothing
Nimbus Solid Men's Flap Collar Neck T-Shirt,Clothing
Northern Lights Striped Men's Polo Neck T-Shirt,Clothing
One For Blue Printed Men's Round Neck T-Shirt,Clothing
Officers Choice Solid Men's Round Neck T-Shirt,Clothing
Orange And Orchid Striped Men's Polo Neck T-Shirt,Clothing
Numero Uno Striped Men's Polo T-Shirt,Clothing
Numero Uno Solid Men's Henley T-Shirt,Clothing
Ninja Turtle Printed Men's Round Neck T-Shirt,Clothing
Osberry Printed Men's Round Neck T-Shirt,Clothing
O And O Printed Men's Round Neck T-Shirt,Clothing
Oharish Printed Men's Round Neck T-Shirt,Clothing
Nucode Solid Men's Polo T-Shirt,Clothing
Nod'R Solid Men's V-neck T-Shirt,Clothing
Norwood Striped Men's Polo Neck Reversible T-Shirt,Clothing
Orange and Orchid Printed Men's Round Neck T-Shirt,Clothing
Onn Solid Men's Round Neck T-Shirt,Clothing
Omtex Solid Men's Polo Neck T-Shirt,Clothing
Ocean 9 Solid Men's Polo T-Shirt,Clothing
Nuteez Printed Men's Round Neck T-Shirt,Clothing
One For Blue Animal Print Men's Round Neck T-Shirt,Clothing
Orange and Orchid Striped Men's V-neck T-Shirt,Clothing
Nucode Solid Men's Polo Neck T-Shirt,Clothing
Okane Solid Men's Polo Neck T-Shirt,Clothing
Osho Fashion Concepts Printed Men's Round Neck T-Shirt,Clothing
Nimbus Printed Men's Round Neck T-Shirt,Clothing
Numero Uno Men's T-Shirt,Sports & Outdoors
Nord51 Solid Men's Polo Neck T-Shirt,Clothing
NKM Solid Men's Polo Neck T-Shirt,Clothing
Nord51 Solid Men's Polo T-Shirt,Clothing
Numero Uno Striped Men's V-neck T-Shirt,Clothing
Oviyon Embroidered Men's Polo Neck T-Shirt,Clothing
Online Maniya Striped Men's Round Neck T-Shirt,Clothing
Numalo Solid Men's Polo Neck T-Shirt,Clothing
Nitlon Solid Men's Round Neck T-Shirt,Clothing
Ocean 9 Self Design Men's Fashion Neck T-Shirt,Clothing
Northern Lights Printed Men's Polo Neck T-Shirt,Clothing
Nikolas Graphic Print Men's Round Neck T-Shirt,Clothing
Ocean 9 Solid Men's Fashion Neck T-Shirt,Clothing
Nivia Solid Men's Polo Neck T-Shirt,Clothing
Outtaskin Solid Men's V-neck T-Shirt,Clothing
"Numalo Striped, Embroidered Men's Polo Neck T-Shirt",Clothing
"Orange and Orchid Solid, Printed Men's Round Neck T-Shirt",Clothing
Nucode Graphic Print Men's V-neck T-Shirt,Clothing
Nuteez Graphic Print Men's Round Neck T-Shirt,Clothing
"One11 Solid Men's, Women's Polo Neck T-Shirt",Clothing
Origin Sport Solid Men's Polo T-Shirt,Sports & Outdoors
Okane Self Design Men's Polo Neck T-Shirt,Clothing
Origin Sport Solid Men's V-neck T-Shirt,Clothing
Northern Lights Printed Men's Round Neck T-Shirt,Clothing
Online Maniya Solid Men's V-neck T-Shirt,Clothing
Out of Print Printed Men's Round Neck T-Shirt,Clothing
Origin Sport Solid Men's Round Neck T-Shirt,Sports & Outdoors
Osho Fashion Concepts Solid Men's V-neck T-Shirt,Clothing
Nucode Geometric Print Men's Round Neck T-Shirt,Clothing
Ocean Race Solid Men's V-neck T-Shirt,Clothing
Ninja Turtle Men's T-Shirt,Clothing
Online Maniya Self Design Men's Round Neck T-Shirt,Clothing
Orange and Orchid Solid Men's Round Neck T-Shirt,Clothing
Northern Lights Solid Men's V-neck T-Shirt,Clothing
One For Blue Animal Print Women's Round Neck T-Shirt,Clothing
Aagam TM-RTTX4 Stainless Steel Mug,Home & Kitchen
Spictex Checkered Boy's Basic Shorts,Clothing
Footshez Women Flats,Shoes
Buyer's Beach BB349,Home & Kitchen
BAAJ Running Shoes,Shoes
Aagam TM-RTX2 Stainless Steel Mug,Home & Kitchen
TARAMA Skinny Fit Fit Women's Jeans,Clothing
Artifa African Tribal Men Wooden Handmade Showpiece  -  16 cm,Toys & Games
Neha Train Wooden Decorative Platter,Home & Kitchen
Furncoms Man With Child Showpiece  -  32 cm,Toys & Games
Sukhson India Gold Plated Decorative Platter,Home & Kitchen
Ethnic Regalia Wooden Rajasthani Musicians Showpiece  -  10 cm,Home & Kitchen
Kakori Handcrafted Seated Musician having Red Color and Nickel Polish Finish Showpiece  -  17 cm,Home & Kitchen
Lavanaya Board Musician Dhapli Showpiece  -  20 cm,Home & Kitchen
Udaipur Art Gallery Wooden Decorative Platter,Home & Kitchen
Pindia Apple Macbook Pro 13 13.3 Inch Mb990hn/A & Mb990ll/A USB Yellow Anti-dust Plug,Electronics
Aadishwar Creations Solid Protective Men's Gloves,Sports & Outdoors
1OAK Women's Floral Print Casual Shirt,Clothing
"Cotson Solid Protective Men's, Women's Gloves",Sports & Outdoors
Pavvoin Lingerie Set,Clothing
1OAK Women's Polka Print Casual Shirt,Clothing
KRAZY KATZ Solid Men's Round Neck T-Shirt,Clothing
diwine jewels Silver Zircon Rhodium NA K Ring,Jewelry
"Joyra Heart Sterling Silver Swarovski Crystal, Swarovski Zirconia Platinum NA K Ring",Jewelry
Synergy Turtle-Blue Coin Bank,Toys & Games
Ethiic Sleeveless Self Design Men's Jacket,Clothing
SKOOKIE Sleeveless Solid Men's Jacket,Clothing
HRX by Hrithik Roshan Full Sleeve Printed Men's Jacket,Clothing
Sri Bansilal Pearls Pearls Tara Mala Mother of Pearl Jewel Set,"Arts, Crafts & Sewing"
My Foot Women Flats,Shoes
Fogg Fashion Store 3003-PK Modish Analog Watch  - For Women,Sports & Outdoors
Luba HH41 Stylo Analog Watch  - For Women,Sports & Outdoors
My Foot Women Wedges,Sports & Outdoors
Pavechas Printed Daily Wear Polycotton Sari,Clothing
"Pavechas Solid, Striped Mangalagiri Cotton Sari",Clothing
Adam's Heel Men Slip On Shoes,Shoes
Nutcase Sticker Wrap Design - Brazil Vintage Flag 800 ml Bottle,Sports & Outdoors
Nutcase Sticker Wrap Design - Us Flag Side Angle Design 800 ml Bottle,Sports & Outdoors
Nutcase Sticker Wrap Design - Uk London City 800 ml Bottle,Sports & Outdoors
Nutcase Sticker Wrap Design - Polka Dots Cool 800 ml Bottle,Sports & Outdoors
Nutcase Sticker Wrap Design - North 800 ml Bottle,Sports & Outdoors
Nutcase Sticker Wrap Design - Pineapple 800 ml Bottle,Sports & Outdoors
Nutcase Sticker Wrap Design - Gummy Bears 800 ml Bottle,Sports & Outdoors
Nutcase Sticker Wrap Design - Mint & Grey Chevron 800 ml Bottle,Sports & Outdoors
Provalley Printed Boy's Round Neck T-Shirt,Clothing
Provalley Printed Boy's Polo Neck T-Shirt,Clothing
Sathiyas Printed Boy's Round Neck T-Shirt,Clothing
Gkidz Solid Boy's Polo Neck T-Shirt,Clothing
Dongli Solid Boy's Round Neck T-Shirt,Clothing
New Day Graphic Print Boy's Round Neck T-Shirt,Clothing
Provogue Slim Fit Men's Jeans,Clothing
Pearl Paradise Dangling Sterling Silver Pearl Silver Dangle Earring,Jewelry
Ben Carter Slim Fit Men's Jeans,Clothing
Pearl Paradise Love Lock Rhodium Silver Drop Earring,Jewelry
The V Collection CDE-934-01 Yellow Gold Pearl Silver Dangle Earring,"Arts, Crafts & Sewing"
The V Collection CDE-942 Yellow Gold Pearl Silver Dangle Earring,Jewelry
Steppings Women Flats,Shoes
Pantof Women Flats,Shoes
YugshaJewels Sparkling YJE-851 Pearl Sterling Silver Dangle Earring,Jewelry
"YugshaJewels Sparkling YJE-816 Pearl, Moonstone Sterling Silver Dangle Earring",Jewelry
The V Collection A1E-1515 Yellow Gold Sterling Silver Dangle Earring,Jewelry
Pearl Paradise Hydro Rhodium Quartz Silver Dangle Earring,Jewelry
Pearl Paradise Designer Collection - (T). Yellow Gold  K Pearl Alloy Drop Earring,"Arts, Crafts & Sewing"
Nector Women Sandals,Shoes
Mochi Women Flats,Shoes
Spiderman Boys Sandals,Shoes
Stanley 14-125 Glass Cutter,Tools & Home Improvement
Stanley 14-318-23 Bolt Cutter,Tools & Home Improvement
Stanley 93-021-22 Pipe Cutter,Tools & Home Improvement
My Foot Women Heels,Sports & Outdoors
Klaur Melbourne Women Heels,Shoes
Nutcase Sticker Wrap Design - Butterfly 800 ml Bottle,Sports & Outdoors
Gasket Slim fit Fit Men's Jeans,Clothing
American Diamond Alloy Jewel Set,Toys & Games
Rajrang Floral Cushions Cover,Home & Kitchen
Tsquare Alloy Jewel Set,Toys & Games
R18Jewels-Fashion&U Fabulous Princess Metal Bangle,Toys & Games
R18Jewels-Fashion&U Sparkle Delight Metal Bangle Set,"Arts, Crafts & Sewing"
"R18Jewels-Fashion&U Peacock Princess Metal, Enamel Yellow Gold Bangle",Jewelry
Vaishali Bindi and Bangles Kundan Style Alloy Jewel Set,Toys & Games
R18Jewels-Fashion&U Sparkling Delight Metal Crystal Bangle Set,Jewelry
Shining Diva Green Drop Kundan Alloy Jewel Set,Toys & Games
R18Jewels-Fashion&U Gorgeous Sparkle Metal Crystal Bangle,Jewelry
eCraftIndia Floral Cushions Cover,Home & Kitchen
R18Jewels-Fashion&U Princess Style Metal Bangle Set,Toys & Games
"R18Jewels-Fashion&U Princess Fashionista Metal, Enamel, Crystal Bangle Set",Jewelry
Kuhuk Fashion Jewelry Metal Bangle Set,Jewelry
NE Women's Leggings,Clothing
PuppetNx Slim Fit Boy's Jeans,Clothing
Dhruva 10 Card Holder,Office Products
Tales & Stories Slim Fit Boy's Jeans,Clothing
Chevron 6 Card Holder,Cell Phones & Accessories
Elligator 10 Card Holder,Office Products
Best 6 Card Holder,Cell Phones & Accessories
Justanned 3 Card Holder,Office Products
Secrid 5 Card Holder,Office Products
Pearlz Ocean Alloy Jewel Set,Toys & Games
"Variation Alloy, Enamel Jewel Set",Toys & Games
Fida Elegant Gold and Red Copper Drop Earring,Jewelry
Tiny Toon Slim Fit Boy's Jeans,Clothing
Seals Slim Fit Boy's Jeans,Clothing
Pink Rose Alloy Jewel Set,Home & Kitchen
Palm Tree Printed Boy's Round Neck T-Shirt,Clothing
Stylowoman Woven Kanjivaram Handloom Tussar Silk Sari,Accessories
Oxyglow Oxynourshing Massage Cream & Aloevera & Carrot Sun Cover Cream With Spf 30,Beauty
Mxofere Combo Papaya Aloevera Jasmine Rose Almond Honey Soap Kit,Beauty
Oxyglow Diamond Facial Kit & Oxynourshing Massage Cream,Beauty
Mxofere Combo Sandal Turmeric Almond Honey Jasmine Mixfruit Papaya Soap Kit,Beauty
Mxofere Combo Lavender Rose Jasmine Papaya Aloevera Soap Kit,Beauty
Rajasthan Crafts Abstract Single Quilts & Comforters Black,Home & Kitchen
Rajasthan Crafts Abstract Single Quilts & Comforters Maroon,Home & Kitchen
Rajasthan Crafts Abstract Single Quilts & Comforters Multicolor,Home & Kitchen
Rajasthan Crafts Abstract Single Quilts & Comforters Pink,Home & Kitchen
Luba DE45 Stylo Analog Watch  - For Women,Sports & Outdoors
Rajasthan Crafts Abstract Single Quilts & Comforters Purple,Home & Kitchen
Rajasthan Crafts Abstract Single Quilts & Comforters Green,Home & Kitchen
"Ridas 923_red Luxy Analog Watch  - For Women, Girls",Sports & Outdoors
Earth Ro System Abstract Single Quilts & Comforters Multicolor,Home & Kitchen
GRJ India Abstract Single Quilts & Comforters Multicolor,Home & Kitchen
Babysid Collection Abstract Single Quilts & Comforters Multicolor,Home & Kitchen
Tuktuk Abstract Single Dohar Black,Home & Kitchen
Onlinemaniya Abstract Single Quilts & Comforters Multicolor,Home & Kitchen
Buy Clues Abstract Single Quilts & Comforters Gold,Home & Kitchen
Rajlaxmi Checkered Single Quilts & Comforters Multicolor,Home & Kitchen
"SVM Navratri Special 7 Analog Watch  - For Girls, Women",Sports & Outdoors
Bajya Abstract Single Quilts & Comforters MultiColour,Home & Kitchen
Shoppingtara Abstract Single Quilts & Comforters Light Blue,Home & Kitchen
Fighter FIGH_008 Digital Watch  - For Couple,Sports & Outdoors
Swiss Trend Artshai1630 Premium Analog Watch  - For Men,Sports & Outdoors
Geneva GEN-05 Crystal Studded Analog Watch  - For Women,Sports & Outdoors
"Annapurna Silks Woven, Embroidered Kanjivaram Handloom Art Silk Sari",Home & Kitchen
Pavechas Printed Kanjivaram Art Silk Sari,Home & Kitchen
Silver Prince Designer Silver Jewel Set,Home & Kitchen
E2O Hand Bag,Sports & Outdoors
Okane Sleeveless Self Design Men's Quilted Jacket,Clothing
Puppet Nx Solid Boy's Basic Shorts,Sports & Outdoors
Yepme 72596 Caitlin - Orange Analog Watch  - For Women,Sports & Outdoors
Luba ghk54 Stylo Analog Watch  - For Women,Sports & Outdoors
Follow Me SH1021 Ladies Leather Analog Watch  - For Women,Sports & Outdoors
Perucci PC-3333Purple Analog Watch  - For Women,Sports & Outdoors
Luba rk526 Rked Analog Watch  - For Women,Sports & Outdoors
Perucci PC-3333Yellow Analog Watch  - For Women,Sports & Outdoors
Perucci PC-301 Analog Watch  - For Men,Sports & Outdoors
Perucci PC-303 Analog Watch  - For Men,Sports & Outdoors
Perucci PC-310 Analog Watch  - For Men,Sports & Outdoors
Perucci PC-312 Analog Watch  - For Men,Sports & Outdoors
Chappin & Nellson CNL-50-White-RG Analog Watch  - For Women,Sports & Outdoors
Chappin & Nellson CNL-50-White Analog Watch  - For Women,Sports & Outdoors
Q&Q DA37J504Y Analog Watch  - For Women,Sports & Outdoors
SP Jewellery Rhodium Alloy Dangle Earring,Jewelry
SP Jewellery Sparkling Trinklets Alloy Dangle Earring,"Arts, Crafts & Sewing"
"Zoya-JQ ZJQ-CMBN-03 Solid Color Analog Watch  - For Girls, Women",Sports & Outdoors
SP Jewellery Alloy Dangle Earring,"Arts, Crafts & Sewing"
"HPD Butterfly Combo Bracelet Look Analog Watch  - For Girls, Women",Sports & Outdoors
SP Jewellery Black Silver 22 K Pearl Alloy Dangle Earring,"Arts, Crafts & Sewing"
Nutcase Sticker Wrap Design - Football Love 800 ml Bottle,Sports & Outdoors
Nutcase Sticker Wrap Design - Blue And White 800 ml Bottle,Sports & Outdoors
Nutcase Sticker Wrap Design - Teal & Pink Watercolors 800 ml Bottle,Beauty
Nutcase Sticker Wrap Design - Beer 800 ml Bottle,Sports & Outdoors
Nutcase Sticker Wrap Design - 8bit - Militart Army Green Camouflage 800 ml Bottle,Sports & Outdoors
Nutcase Sticker Wrap Design - Sports Ball 800 ml Bottle,Sports & Outdoors
3 Degre Full Sleeve Solid Men's Jacket,Clothing
Port Fusion Football Shoes,Sports & Outdoors
Port Football Shoes,Sports & Outdoors
Allen Solly Junior Slim Fit Girl's Trousers,Clothing
Gesture 8062-WH Stylo Analog Watch  - For Women,Sports & Outdoors
Jazzup Baby Boy's Romper,Baby
Peora Rhodium Sterling Silver Stud Earring,Jewelry
Scrunchh Sawan Bhaado Alloy Stud Earring,Jewelry
"Eclat 514278RTN Rhodium Swarovski Crystal Alloy, Brass Stud Earring",Jewelry
Nutcase Sticker Wrap Design - Koala Bear 800 ml Bottle,Sports & Outdoors
Nutcase Sticker Wrap Design - Lucky Elements 800 ml Bottle,Sports & Outdoors
Oxyglow Fruit Massage Cream With Vitamin-E & Almond Under Eye Repair Care,Beauty
Oxyglow Saffron with vitamin-E Gold Massage Cream & Almond Under Eye Repair Care,Beauty
Fashion Centre Double Bed Mosquito Net,Sports & Outdoors
The Fine World Copper Metal Embedded With Dark Pink Stones Brass Zircon Metal Drop Earring,"Arts, Crafts & Sewing"
Rakshita Collection Sleeveless Solid Men's QUILTED Jacket,Clothing
Parijat Embroidered Women's Straight Kurta,Clothing
The Fine World Cutwork Embedded Silver Zircon Metal Drop Earring,"Arts, Crafts & Sewing"
The Fine World Crescent Shaped Silver Zircon Metal Drop Earring,"Arts, Crafts & Sewing"
FS Mini Klub Solid Baby Boy's Pathani Kurta,Clothing
The Fine World Silver Base Silver Zircon Metal Drop Earring,"Arts, Crafts & Sewing"
FS Mini Klub Solid Boy's Pathani Kurta,Clothing
The Fine World Glitzy Shimmering Stones Brass Zircon Metal Drop Earring,"Arts, Crafts & Sewing"
Ratan Jaipur Checkered Women's Straight Kurta,Clothing
Xemex ST1025SL07 New Generation Analog Watch  - For Women,Sports & Outdoors
Luba j52 Stylo Analog Watch  - For Women,Sports & Outdoors
Timebre TMLXPRL53 Premium Analog Watch  - For Women,Sports & Outdoors
Offspring Solid Single Blanket Peach,Home & Kitchen
Nisa Pearls Mother of Pearl Jewel Set,Home & Kitchen
Offspring Solid Single Blanket Pink,Home & Kitchen
Babysid Collections Self Design Single Wrapper Multicolor,Clothing
Offspring Solid Single Blanket Yellow,Home & Kitchen
Offspring Printed Single Blanket Blue,Home & Kitchen
"Offspring Embroidered, Solid Single Wrapper White, Green",Clothing
Offspring Printed Single Wrapper Multicolor,Clothing
Ireeya Abstract Single Coral Blanket Blue,Home & Kitchen
"Offspring Embroidered, Solid Single Wrapper White, Pink",Clothing
Offspring Solid Single Blanket Green,Home & Kitchen
"Ireeya Abstract Single Coral Blanket White, Purple",Home & Kitchen
Carter'S Self Design Single Blanket Multicolor,Home & Kitchen
My NewBorn Solid Single Wrapper Assorted Muti Colors,Clothing
Chalk by Pantaloons Solid Boy's Basic Shorts,Clothing
Mochi Women Wedges,Shoes
Powell Slim Fit Men's Jeans,Clothing
RRTC RRTC1105SM00 Basic Analog Watch  - For Women,Sports & Outdoors
Parbat Nova-Orng-Strips Running Shoes,Health & Personal Care
OnlinePearlShop Pearl Alloy Stud Earring,Jewelry
SP Jewellery Black Silver Pearl Alloy Hoop Earring,"Arts, Crafts & Sewing"
Mxofere Combo Orange Sandal Turmeric Jasmine Papaya Aloevera Soap Kit,Beauty
Mxofere Combo Papaya Mixfruit Jasmine Rose Almond Honey Soap Kit,Beauty
Mxofere Combo Orange Papaya Jasmine Lemongrass Almond Honey Soap Kit,Beauty
Mxofere Combo Orange Soap And Aloevera Lemon Facewash Kit,Beauty
Mxofere Combo Lemongrass Sandal Turmeric Jasmine Papaya Aloe Veera Soap Kit,Beauty
Mxofere Combo Almod Honey Soap And Neem Tulsi Teatree Facewash Kit,Beauty
Mxofere Combo Lemongrass Jasmine Sandal Turmeric Lavender Anti Acne Soap Kit,Beauty
Zadine Women's Leggings,Clothing
Mxofere Combo Anti Acne Orange Jasmine Mixfruit Papaya Soap Kit,Beauty
Mxofere Combo Mixfruit Rose Jasmine Papaya Aloevera Soap Kit,Beauty
Mxofere Combo Jasmine Papaya Aloevera Rose Neem Tulsi Soap Kit,Beauty
Provalley Solid Boy's Basic Shorts,Clothing
Mxofere Combo Rose Papaya Lemongrass Sandal Turmeric Jasmine Soap Kit,Beauty
Little Star Solid Boy's Basic Shorts,Clothing
Mxofere Combo Lemongrass Mixfruit Almond Honey Orange Rose Soap Kit,Beauty
Mxofere Combo Rose Jasmine Almond Honey Aloevera Mixfruit Soap Kit,Beauty
Nillkin Amazing H Tempered Glass for Htc Desire 516,Cell Phones & Accessories
You2Deal Wood & Iron Handicraft Antique Style Home Decor Cycle Gift Item Showpiece  -  25 cm,Home & Kitchen
Perucci PC-502C Decker Analog Watch  - For Men,Sports & Outdoors
Marwar Handmade Iron Bicycle Toy Showpiece  -  20 cm,Toys & Games
Scratchgard Original Armour Shield - N830 Screen Guard for Nokia Lumia 830,Cell Phones & Accessories
Marwar Bicycle Toy Showpiece  -  20 cm,Toys & Games
Atrangee Tote,Home & Kitchen
Perucci PCC-501C Decker Analog Watch  - For Men,Sports & Outdoors
Perucci PC-222 Decker Analog Watch  - For Men,Sports & Outdoors
Nillkin NKL-1257 Tempered Glass for Nokia Lumia L830,Cell Phones & Accessories
Perucci Pc-126 & Pc-257 Decker Analog Watch  - For Men,Sports & Outdoors
Perucci Pc-122 & Pc-126 Decker Analog Watch  - For Men,Sports & Outdoors
Digital Marketing NKL-830 Mirror Screen Guard for Nokia Lumia 830,Cell Phones & Accessories
"Pearl Paradise Dark Spot Yellow Gold Cubic Zirconia, Pearl Alloy Stud Earring",Jewelry
Perucci PC-702W Decker Analog Watch  - For Men,Sports & Outdoors
Funcart Party Time  - Food Grade Plastic,Home & Kitchen
Nillkin NIMS12 Mirror Screen Guard for Nokia Lumia 530,Cell Phones & Accessories
Perucci Pc-257-2ps Decker Analog Watch  - For Men,Sports & Outdoors
Gadgetshieldz 1358SPFB Screen Guard for Nokia Lumia 830,Cell Phones & Accessories
Krishna Pearls & Jewellers Pearl Alloy Stud Earring,Jewelry
"EZ Life Funky 3-Pc Kids Cutlery Set-Pleasing Panda  - Stainless Steel, Food Grade Plastic",Home & Kitchen
Perucci PCC-502C Decker Analog Watch  - For Men,Watches
Total Care TC-L830 Screen Guard for Nokia Lumia 830,Electronics
Funcart Frolic Birthday  - Food Grade Plastic,Home & Kitchen
Perucci PC-501C & PC-219 Decker Analog Watch  - For Men,Sports & Outdoors
Nillkin 654 Tempered Glass for Samsung Galaxy S5 Mini,Cell Phones & Accessories
Perucci PC-122 Decker Analog Watch  - For Men,Sports & Outdoors
FliFit SG618 Matte Screen Guard for Nokia Lumia 830,Cell Phones & Accessories
Perucci PC-218 Decker Analog Watch  - For Men,Sports & Outdoors
Vatsalya Creation Outstanding Alloy Jewel Set,Toys & Games
Clear Shield CS-397 Screen Guard for Nokia Lumia 830,Cell Phones & Accessories
Perucci PC-501B & PC-226 Decker Analog Watch  - For Men,Sports & Outdoors
Vatsalya Creation Attractive Zinc Jewel Set,Home & Kitchen
Nillkin NKL-1282 Tempered Glass for Sony Xperia T3,Cell Phones & Accessories
Perucci PC-414W Decker Analog Watch  - For Men,Sports & Outdoors
Karpine Glass Screen Guard for Nokia Lumia 830,Cell Phones & Accessories
Karpine Clear Screen Guard for Nokia lumia 830,Cell Phones & Accessories
Perucci PC-4444 Decker Analog Watch  - For Women,Sports & Outdoors
Chevron NL830 Protection Ultra Clear Screen Guard for Nokia Lumia 830,Cell Phones & Accessories
Ortel Transparent Screen Guard for Nokia Lumia 830,Cell Phones & Accessories
Nillkin G09 Tempered Glass for Samsung Galaxy A3(A300),Cell Phones & Accessories
Casotec Super Clear Screen Protector Screen Guard for Nokia Lumia 830,Cell Phones & Accessories
Total Care TCMTZC1FB Matte Front & Back Protector for Sony Xperia Z1 Compact,Cell Phones & Accessories
Nillkin Z3-84345 Mirror Screen Guard for Blackberry Z3,Cell Phones & Accessories
Nillkin NIMS09 Mirror Screen Guard for LG G3,Cell Phones & Accessories
Chicopee Women Flats,Shoes
Love Baby Cartoon Set of Towels,Home & Kitchen
Momento Regular Fit Men's Jeans,Clothing
Jack & Jones Slim Fit Men's Jeans,Clothing
Sassoon Cotton Set of Towels,Home & Kitchen
LUBA bh23 Stylo Analog Watch  - For Men,Sports & Outdoors
Mark Home Cotton Bath Towel,Home & Kitchen
Mintha Cotton Bath Towel,Home & Kitchen
The Fine World Sky Blue Stones On A Silver Base Silver Zircon Metal Drop Earring,"Arts, Crafts & Sewing"
Luba num8 Ring Analog Watch  - For Men,Sports & Outdoors
LUBA g58 Stylo Analog Watch  - For Men,Sports & Outdoors
LUBA ty47 Stylo Analog Watch  - For Men,Sports & Outdoors
The Fine World Silver Studded Brass Zircon Metal Drop Earring,"Arts, Crafts & Sewing"
LUBA rt23 Stylo Analog Watch  - For Men,Sports & Outdoors
Luba qw12 Stylo Analog Watch  - For Men,Sports & Outdoors
The Fine World Style Symbol For Girls Silver  K Zircon Metal Drop Earring,"Arts, Crafts & Sewing"
Scheffer's SC-B-S-8003 Analog Watch  - For Men,Sports & Outdoors
The Fine World Studded Onto Crescent Shaped Silver  K Zircon Metal Drop Earring,Jewelry
The Fine World Cutwork Studded Brass Zircon Metal Drop Earring,"Arts, Crafts & Sewing"
Pink Rose Passion Zircon Metal Drop Earring,Jewelry
LUBA HF45 Stylo Analog Watch  - For Men,Sports & Outdoors
Luba JH854 Design Analog Watch  - For Men,Sports & Outdoors
Luba HD142 Antq Analog Watch  - For Men,Sports & Outdoors
Scheffer's SC-B-S-8004 Analog Watch  - For Men,Sports & Outdoors
Luba er23 Stylo Analog Watch  - For Men,Sports & Outdoors
The Fine World Victorian Type Brass Zircon Metal Drop Earring,Tools & Home Improvement
The Fine World Long Letkan Silver Zircon Metal Drop Earring,"Arts, Crafts & Sewing"
The Fine World Glitzy Shimmering Stones Silver Zircon Metal Drop Earring,"Arts, Crafts & Sewing"
Scheffer's SC-W-S-8004 Analog Watch  - For Men,Sports & Outdoors
The Fine World Coloured Stone Letkan Brass Zircon Metal Drop Earring,"Arts, Crafts & Sewing"
Swisstyle SS-GR1409-BLK-CH Flunky Analog Watch  - For Men,Sports & Outdoors
