Product Name,Categories
Alisha Solid Women's Cycling Shorts,Clothing
FabHomeDecor Fabric Double Sofa Bed,Home & Kitchen
AW Bellies,Toys & Games
Sicons All Purpose Arnica Dog Shampoo,Pet Supplies
Eternal Gandhi Super Series Crystal Paper Weights  with Silver Finish,Home & Kitchen
"dilli bazaaar Bellies, Corporate Casuals, Casuals",Shoes
Ladela Bellies,Toys & Games
Carrel Printed Women's,Clothing
Sicons All Purpose Tea Tree Dog Shampoo,Pet Supplies
Freelance Vacuum Bottles 350 ml Bottle,Health & Personal Care
Style Foot Bellies,Toys & Games
Sicons Conditioning Conditoner Dog Shampoo,Beauty
dongli Printed Boy's Round Neck T-Shirt,Clothing
SWAGGA Women Clogs,Shoes
Kennel Rubber Dumbell With Bell - Small Rubber Rubber Toy For Dog,Pet Supplies
Glus Wedding Lingerie Set,Home & Kitchen
Veelys Shiny White Quad Roller Skates - Size 4.5 UK,Sports & Outdoors
Bulaky vanity case Jewellery Vanity Case,Tools & Home Improvement
FDT Women's Leggings,Clothing
Madcaps C38GR30 Men's Cargos,Clothing
Bengal Blooms Rose Artificial Plant  with Pot,"Patio, Lawn & Garden"
Indcrown Net Embroidered Semi-stitched Lehenga Choli Material,"Arts, Crafts & Sewing"
Shopmania Music Band A5 Notebook Spiral Bound,Office Products
"Tiara Diaries 2016-2017 Designer LA Kaarta ""TAKING ACTION GETTING RESULT"" (Set of 3) B5 Notebook Hard Bound",Office Products
KAJCI Embroidered Women's Waistcoat,Clothing
Packman 8 x 10 inches Security Bags Without POD Jacket Courier Bag Security Bag,Sports & Outdoors
Pick Pocket Embroidered Women's Waistcoat,Clothing
Angelfish Silk Potali Potli,Accessories
Oye Boy's Dungaree,CDs & Vinyl
Nuride Canvas Shoes,Shoes
OM SHIVAKRITI Square wall Clock Showpiece  -  38.1 cm,Home & Kitchen
Himmlisch ST381 Magnetic Sun Shade For Maruti Alto,Tools & Home Improvement
Rapter BNC-179 BNC Wire Connector,Electronics
Vishudh Printed Women's Straight Kurta,Clothing
Vishudh Printed Women's Anarkali Kurta,Clothing
BuildTrack PIR Wireless Motion Sensor - One Switch Control Wireless Sensor Security System,Electronics
Skayvon SUMMERSIBLE SINGLE PHASE PUMP CONTROLLER Wired Sensor Security System,Tools & Home Improvement
MASARA Solid Women's Straight Kurta,Clothing
Rapter BNC-047 BNC Wire Connector,Electronics
Skayvon SUBMERSIBBLE THREE PHASE PUMP CONTROLLER Wired Sensor Security System,Tools & Home Improvement
Behringer Xenyx 502 Analog Sound Mixer,Musical Instruments
Roadster Men's Zipper Solid Cardigan,Clothing
Noor Embroidered Women's Straight Kurta,Clothing
Libas Printed Women's A-line Kurta,Clothing
Libas Printed Women's Anarkali Kurta,Clothing
HRS ULTIMATE BOY Chest Pads,Sports & Outdoors
Vermello Men Casual Brown Genuine Leather Belt,Accessories
HRS CLUB BOY Thigh Pads,Sports & Outdoors
Ligans NY Men Formal Black Genuine Leather Belt,Accessories
Elegance Polyester Multicolor Abstract Eyelet Door Curtain,Home & Kitchen
Liza Women Wedges,Shoes
HRS ULTIMATE BOY Elbow Pads,Sports & Outdoors
Sathiyas Cotton Bath Towel,Home & Kitchen
HRS ULTIMATE MEN Chest Pads,Sports & Outdoors
Eurospa Cotton Terry Face Towel Set,Home & Kitchen
SANTOSH ROYAL FASHION Cotton Printed King sized Double Bedsheet,Home & Kitchen
CASEDEAL Microsoft Nokia lumia x2 Back Panel,Cell Phones & Accessories
Mario Gotze Women's Printed Casual Orange Shirt,Clothing
Jaipur Print Cotton Floral King sized Double Bedsheet,Home & Kitchen
Shilpi NHSCN003 Coin Bank,Toys & Games
Babeezworld Dungaree Baby Boy's  Combo,Clothing
Redbag Eight Armed Goddess Sherawali Maa Showpiece  -  10.8 cm,Toys & Games
"Proence Weight Gainers, Mass Gainers",Health & Personal Care
Discountgod Men's Checkered Casual Shirt,Clothing
Silver Streak Men's Printed Casual Denim Shirt,Clothing
"Cobra Paris CO6394A1 Analog Watch  - For Men, Boys",Sports & Outdoors
TEN TEN Women's Black Knee Length Boots Boots,Sports & Outdoors
"Aries Gold G 729 S-BK Analog Watch  - For Men, Boys",Sports & Outdoors
Carlton Boots,Sports & Outdoors
Maserati Time R8851116001 Analog Watch  - For Boys,Sports & Outdoors
"Vizion 8503B-1RED Cold Light Digital Watch  - For Boys, Girls",Sports & Outdoors
"Camerii WM64 Elegance Analog Watch  - For Men, Boys",Sports & Outdoors
Reckler Slim Fit Men's Jeans,Clothing
Quechua Arpenaz Novadry Boots,Shoes
"Colat COLAT_MW20 Sheen Analog Watch  - For Men, Women, Boys, Girls",Sports & Outdoors
Steppings Trendy Boots,Shoes
Rochees RW38 Analog Watch  - For Boys,Sports & Outdoors
"Rorlig RR-028 Expedition Analog Watch  - For Men, Boys",Sports & Outdoors
Catwalk Boots,Shoes
Magnum Footwear Lifestyle,Automotive
T STAR UFT-TSW-005-BK-BR Analog Watch  - For Boys,Sports & Outdoors
Rialto Boots,Shoes
Kielz Ladies Boots,Shoes
"Alfajr WY16B Youth Digital Watch  - For Men, Boys",Sports & Outdoors
La Briza Ashley Boots,Shoes
"TAG Heuer CAU1116.BA0858 Formula 1 Analog Watch  - For Boys, Men",Sports & Outdoors
Salt N Pepper 13-019 Femme Black Boots Boots,Sports & Outdoors
Shuz Touch Boots,Shoes
Wrangler Skanders Fit Men's Jeans,Clothing
Salt N Pepper 14-664 Denny Black Boots Boots,Sports & Outdoors
"Costa Swiss CS-2001 Analog Watch  - For Boys, Men",Sports & Outdoors
Crocs Boots,Sports & Outdoors
"Breitling AB011010/BB08 131S Chronomat 44 Analog Watch  - For Boys, Men",Sports & Outdoors
Lyc White Casual Boots,Shoes
Myra Comfortable Boots,Shoes
"Calibro SW-125 Analog-Digital Watch  - For Men, Boys",Sports & Outdoors
Get Glamr Designer Uggy Boots,Pet Supplies
Rochees RW50 Analog Watch  - For Boys,Sports & Outdoors
Salt N Pepper 13-516 Greta Red Boots,Sports & Outdoors
Fluid DMF-002-GR01 Digital Watch  - For Boys,Sports & Outdoors
"Rorlig RR-030 Essentials Analog Watch  - For Men, Boys",Sports & Outdoors
Wrangler Regular Fit Men's Jeans,Clothing
"Disney DW100230 Digital Watch  - For Boys, Girls",Sports & Outdoors
Salt N Pepper 13-167 Marsha Red Boots,Home & Kitchen
"Cartier W6701005 Analog Watch  - For Boys, Men",Sports & Outdoors
Bruno Manetti Cannelita Boots,Shoes
Stylistry Maxis Shde6603brwoboot3104 Boots,Shoes
"Lois Caron LCS-4032 Analog Watch  - For Boys, Men",Sports & Outdoors
"Felix Y 39 Analog Watch  - For Boys, Men",Sports & Outdoors
Kielz Boots,Shoes
Sakay Country Leather Boots,Automotive
La Briza Black Boots,Shoes
"Kool Kidz DMK-012-QU02 Analog Watch  - For Girls, Boys",Sports & Outdoors
"Franck Bella FB0128B Analog Watch  - For Men, Boys",Sports & Outdoors
"Kool Kidz DMK-003-YL 03 Analog Watch  - For Girls, Boys",Sports & Outdoors
"Vizion 8502-6BLACK Sports Series Digital Watch  - For Boys, Girls",Sports & Outdoors
Vencer Stella 7lyt1011 Digital Watch  - For Boys,Sports & Outdoors
La Briza Mile Boots,CDs & Vinyl
"Casela CAS-W-13 Basic Analog Watch  - For Boys, Girls",Sports & Outdoors
Sneha Unique Boots,Sports & Outdoors
Timer TC_-_690143 Analog Watch  - For Boys,Sports & Outdoors
NE Regular Fit Men's Jeans,Clothing
"Colat COLAT_M08 Roman Numerals Analog Watch  - For Men, Boys",Sports & Outdoors
Belle Gambe Boots,Toys & Games
"Titan 1639SL03 Analog Watch  - For Boys, Men",Sports & Outdoors
Selfie Boots,Shoes
Clincher Semonday Boots,Sports & Outdoors
"Srushti Art Jewelry Megnet_Led_Sport_BlackRed1 Digital Watch  - For Men, Women, Boys, Girls",Sports & Outdoors
"Q&Q VQ13-008 Analog Watch  - For Girls, Boys",Sports & Outdoors
"Escort E-1700-906_Blk Analog Watch  - For Men, Boys",Sports & Outdoors
Roxy Boots,Sports & Outdoors
Lee Men's Jeans,Clothing
Bruno Manetti 676 Boots,Shoes
"Estilo 1056 Analog Watch  - For Boys, Men",Sports & Outdoors
Jack klein BlackLed Digital Watch  - For Boys,Sports & Outdoors
"North Moon IW-005-FK Silicone Ion Digital Watch  - For Boys, Girls, Women",Sports & Outdoors
Foot Candy Boots,Sports & Outdoors
Credos Boots,Shoes
"Rich Club Apple Shaped LED Digital Watch  - For Boys, Girls",Sports & Outdoors
"Skmei AD1031-Black Formal Analog-Digital Watch  - For Men, Boys",Sports & Outdoors
"Kms Ironman_Look_Led_Black11 Digital Watch  - For Men, Women, Girls, Boys",Sports & Outdoors
Anand Archies Boots,Shoes
Magnum Footwear Lifestyle Boots,Shoes
Swag 670038 Analog Watch  - For Boys,Sports & Outdoors
Bonzer Boots,Shoes
Roadster Skinny Fit Fit Men's Jeans,Clothing
Selfie Black Denim Boots,Clothing
Steppings Boots Boots,Shoes
"Q&Q LLA2-213 Digital Watch  - For Boys, Girls",Sports & Outdoors
Belle Gambe Winter Boots,Shoes
"Hala Red In Black trendy digital Digital Watch  - For Boys, Girls, Men",Sports & Outdoors
"Franck Bella FB74C Analog Watch  - For Boys, Men",Sports & Outdoors
Carlton London Boots,CDs & Vinyl
Ridas Apl_led_black Apple Shape Digital Watch  - For Boys,Sports & Outdoors
La Briza Andria Boots,Shoes
"Skmei 1070BLK Sports Analog-Digital Watch  - For Men, Boys",Sports & Outdoors
"Skmei AD1057-Dark-Orange Sports Analog-Digital Watch  - For Men, Boys",Sports & Outdoors
Urban Country Ladies Boots,Sports & Outdoors
Now SP-ETHNIC Analog Watch  - For Boys,Sports & Outdoors
"Disney MSFR190-01B Analog Watch  - For Boys, Girls",Sports & Outdoors
Get Glamr Designer Yuvu Boots,Pet Supplies
Remson India Boots,Beauty
Jacques Farel KWD2324 Analog Watch  - For Boys,Sports & Outdoors
Salt N Pepper 13-455 Pisa Black Boots,Home & Kitchen
"Oxter Chrono Blue Italia Analog Watch  - For Men, Boys",Sports & Outdoors
Klaur Melbourne Boots,Shoes
"Positif Pfbk612 Analog Watch  - For Men, Boys",Sports & Outdoors
"D'SIGNER 688RGM _BRN Analog Watch  - For Men, Boys",Sports & Outdoors
Salt N Pepper 13-019 Femme Taupe Boots Boots,Home & Kitchen
"Franck Bella FB127A Analog Watch  - For Boys, Men",Sports & Outdoors
Get Glamr Stylish Boots,Beauty
"Felix 3541 W-S METAL Analog Watch  - For Boys, Girls",Sports & Outdoors
"Skmei DG0939-Red Sports Digital Watch  - For Men, Boys",Sports & Outdoors
Do Bhai Boots,Automotive
"Vizion 8502-4BLUE Sports Series Digital Watch  - For Boys, Girls",Sports & Outdoors
Sam Stefy Boots,Toys & Games
TEN TEN Women's Tan Mid Length Boots Boots,Shoes
Get Glamr Dazzle Boots,Sports & Outdoors
"Jack Klein Goldjack Analog Watch  - For Boys, Men",Sports & Outdoors
Dearfoams Boots,Shoes
"fastrack 38015PL01 Analog Watch  - For Men, Boys",Sports & Outdoors
"A Avon PK_504 Analog Watch  - For Men, Boys",Sports & Outdoors
"Franck Bella FB0122DD Analog Watch  - For Men, Boys",Sports & Outdoors
Salt N Pepper 12-298 Taupe Boots,Home & Kitchen
"Alfajr WQ18 Qibla Compass Digital Watch  - For Men, Boys, Girls",Sports & Outdoors
"Sale Funda SFGFU694 Analog Watch  - For Boys, Men",Sports & Outdoors
"Britex BT2050+BT3101 He & She Analog Watch  - For Couple, Women, Men, Boys, Girls",Sports & Outdoors
TSG Kelz Boots,Sports & Outdoors
"3wish CUR-BLUE Silver Blue 8023 Analog Watch  - For Boys, Men",Sports & Outdoors
J.D.H. 111-222 Boots,Sports & Outdoors
"Disney 98189 Analog Watch  - For Boys, Girls",Sports & Outdoors
Get Glamr Designer Snowra Boots,Pet Supplies
"Lenco DCOMPASS2010 Quazi Analog-Digital Watch  - For Men, Boys",Sports & Outdoors
Pinza Black Christmas Boots,Toys & Games
Salt N Pepper 13-552 Rebacca Almond Boots,Home & Kitchen
"Rockstar R_056 Chrono Analog Watch  - For Men, Boys",Sports & Outdoors
Disney DW100405 Digital Watch  - For Boys,Sports & Outdoors
"Vizion 8502-7PURPLE Sports Series Digital Watch  - For Boys, Girls",Sports & Outdoors
"Disney LP-1008 (Yellow) Analog Watch  - For Boys, Girls",Sports & Outdoors
"Elantra S 10 Analog Watch  - For Boys, Men",Sports & Outdoors
Willy Winkies Black Boots,Sports & Outdoors
"Marvel DW100243 Digital Watch  - For Boys, Girls",Sports & Outdoors
DJH Boots,Shoes
"Franck Bella FB123D Analog Watch  - For Men, Boys",Sports & Outdoors
"Skmei DG1010-Black-Gold Sports Digital Watch  - For Men, Boys, Women, Girls",Sports & Outdoors
Pinza Blue Cowboy Boots,Shoes
"Eleganzza Denim Denim Analog Watch  - For Men, Women, Boys, Girls, Couple",Clothing
CatBird Boots,Shoes
Bruno Manetti 664 Boots,Shoes
"Lenco Bdblue Tango Analog Watch  - For Men, Boys",Sports & Outdoors
Get Glamr Designer Kuyal Boots,Pet Supplies
"Zoop C4040PP03 Digital Watch  - For Boys, Girls",Sports & Outdoors
"Shoppingekart DS0222 Rewin Pack of 3 Digital Watch  - For Boys, Girls, Couple, Men",Sports & Outdoors
Stylistry Maxis Sa3228-25relong1712 Boots,Shoes
Salt N Pepper 14-475 Dorthea Almond Boots Boots,Home & Kitchen
"D'Signer 681GM_WHT Analog Watch  - For Men, Boys",Sports & Outdoors
"SwissFire 205SM005 Analog Watch  - For Boys, Men",Sports & Outdoors
"A Avon PK_741 Analog Watch  - For Men, Boys",Sports & Outdoors
Carl 3346-1-Cheetablue Boots,Shoes
Logues LGSWATCH61003PP DIGI YELLOW Sports Analog-Digital Watch  - For Boys,Sports & Outdoors
Swag 670014 Analog Watch  - For Boys,Sports & Outdoors
"Zoop C3030PP05 Analog Watch  - For Boys, Girls",Sports & Outdoors
20Dresses Brown Shiver Me Timbers Boots,Sports & Outdoors
"ezyPRNT ""RH"" Golf Ball -   Size: 4.26 cm,  Diameter: 4.26 cm",Sports & Outdoors
"ezyPRNT ""BC"" Golf Ball -   Size: 4,  Diameter: 4.26 cm",Sports & Outdoors
"ezyPRNT ""OL"" Golf Ball -   Size: 4.26 cm,  Diameter: 4.26 cm",Sports & Outdoors
"ezyPRNT ""CV"" Golf Ball -   Size: 4,  Diameter: 4.26 cm",Sports & Outdoors
Traditions Printed Protective Men's Gloves,Sports & Outdoors
First Choice Cotton Embroidered Diwan Set,Home & Kitchen
Eccellente Solid Hip Hop Cap,Sports & Outdoors
Nechams Resin Magnetic Magnetic Melamine Small Whiteboards,Office Products
JASPO Thunder Intact Superior Senior Skates Combo (skates+helmet+knee+elbow+bag)suitable for age upto 6 to 14 years Skating Kit,Sports & Outdoors
Masaba for Magic fairy Girl's Layered Pink Dress,Toys & Games
Momin Libas AK2414 Kashibo Solid Abaya No,Clothing
ACM Pouch for Swipe Elite Plus,Cell Phones & Accessories
A R ENTERPRISES musical wlking cow,Toys & Games
SANTOSH ROYAL FASHION Cotton Embroidered Diwan Set,Clothing
ShoeBuzz Casuals,Shoes
Zed Loafers,Shoes
House This Queen Cotton Duvet Cover,Home & Kitchen
ACM Pouch for Intex Aqua Lions 3g,Sports & Outdoors
womaniya Alloy Bracelet,Sports & Outdoors
Taj Pearl Alloy Cuff,Sports & Outdoors
JASPO Saphire Dual Shoe Skates Combo Size 5 Skating Kit,Sports & Outdoors
Bento Musical Teddy Bear,Toys & Games
Wake Up Competition Full Sleeve Striped Men's Sweatshirt,Sports & Outdoors
Cellbazaar Blackberry 8520 WHITE LCD LCD,Cell Phones & Accessories
Dressberry Gold Synthetic  Clutch,Beauty
Mast & Harbour Black Synthetic  Clutch,Automotive
JQR JQR Sports Shoes Running Shoes,Shoes
Sisel Printed Poly Cotton Women's Stole,Clothing
"Knight Ace Kraasa Sports Running Shoes, Cycling Shoes, Walking Shoes",Sports & Outdoors
"Great Art Floral Print Wool, Viscose, 20% Kashmiri wool, 50% Cashmilon and 30% Wool ruffle yarn Women's Stole",Clothing
Indistar Self Design Viscose Women's Stole,Accessories
Glacier Running Shoes,Sports & Outdoors
Dressberry Black Synthetic  Clutch,Automotive
Zoe Marciano Blue Heavy-duty satin wong fabric  Clutch,Home & Kitchen
Asics Gel-Cumulus 17 Running Shoes,Sports & Outdoors
Mast & Harbour Gold Synthetic  Clutch,Automotive
Asics Gel-Kayano 22 Running Shoes,Sports & Outdoors
Dressberry Orange Synthetic  Clutch,Automotive
Dressberry Green Synthetic  Clutch,Automotive
Escan Lace Up,Clothing
Nine Maternity Wear Women's Fit and Flare Dress,Clothing
"Kleio Festive, Party, Casual Blue PU  Clutch",Clothing
Skipper Blends Aqua Striped Eyelet Window Curtain,Home & Kitchen
Mizuno Lightweight Hoody Solid Men's Wind Cheater,Sports & Outdoors
"Turbo MSE TEST LITE Batting Gloves (Men, White, Orange)",Sports & Outdoors
"Turbo LEAGUE Batting Gloves (Men, White, Blue)",Sports & Outdoors
Stamin Mass Gainers,CDs & Vinyl
Pure Source Psi-As-Hanggnrlx Relaxing Liquid Air Freshener,Health & Personal Care
Svt Ada Collections Formal Full Sleeve Checkered Women's Top,Clothing
Svt Ada Collections Party 3/4 Sleeve Checkered Women's Top,Clothing
Svt Ada Collections Casual Full Sleeve Checkered Women's Top,Clothing
"Asian Gems & Jewels 5 Dhaatu Metal, Alloy Opal Ring",Jewelry
"Asian Gems & Jewels 5 Dhaatu Metal, Alloy Amethyst Ring",Jewelry
Kings Multicolor Tassels,Clothing
Avsar Sachi Gold Diamond 18 K Ring,Jewelry
Peppermint Blues Casual Sleeveless Printed Women's Top,Clothing
Nishtaa Yellow Gold 22 K Ring,Jewelry
Xpert Schoolboys Blk Lace Up Shoes,Shoes
Just In Time Fashions Women's A-line Dress,Clothing
Yepme Women's Gathered Dress,Clothing
Van Heusen Men's Printed Party Shirt,Clothing
Eshoppee Laughing Buddha For Success And Wealth Showpiece  -  12 cm,"Arts, Crafts & Sewing"
Karatcraft Triniya Promise Gold Diamond 18 K Ring,Jewelry
Mykraft Girl's A-line Dress,Clothing
The Cranberry Club Girl's Gathered Dress,Clothing
Fashion Tree Men's Solid Formal Shirt,Clothing
Peter England Men's Solid Formal Shirt,Clothing
Gee & Bee Casual Printed Women's Kurti,Clothing
Dumdaar.Com Casual Short Sleeve Self Design Women's Top,Clothing
"F&S Casual, Party Short Sleeve Self Design Women's Top",Clothing
Oviya Casual Sleeveless Self Design Women's Top,Clothing
The Clove Casual 3/4 Sleeve Self Design Women's Top,Clothing
The Vanca Formal Full Sleeve Self Design Women's Top,Clothing
Fantasy Ika Casual Short Sleeve Solid Women's Top,Clothing
Fantasy Ika Casual 3/4 Sleeve Self Design Women's Top,Clothing
Ausy Casual Short Sleeve Floral Print Women's Top,Clothing
Ausy Casual Short Sleeve Printed Women's Top,Clothing
WearYourShine by PCJ The Joe Gold Diamond 18 K Ring,Toys & Games
Shilpkala Casual Short Sleeve Printed Women's Top,Clothing
Shilpkala Casual Sleeveless Solid Women's Top,Clothing
Shilpkala Casual Cape Sleeve Printed Women's Top,Clothing
Shilpkala Casual Bell Sleeve Printed Women's Top,Clothing
Shilpkala Casual Sleeveless Printed Women's Top,Clothing
Shilpkala Casual Sleeveless Embellished Women's Top,Clothing
Shilpkala Casual Sleeveless Self Design Women's Top,Clothing
BlueStone The Juliette Yellow Gold Diamond 18 K Ring,Jewelry
Karatcraft Om Gold Diamond 18 K Ring,Jewelry
Karatcraft Dulce Gold Diamond 18 K Ring,Jewelry
"Soie Casual, Festive, Formal, Lounge Wear, Party Sleeveless Embellished, Solid Women's Top",Clothing
Aaliya Casual Sleeveless Embellished Women's Top,Clothing
Karatcraft Robini Emerald Gold Diamond 18 K Ring,Jewelry
"@499 Casual, Festive, Formal, Lounge Wear, Party Sleeveless Embellished Women's Top",Clothing
Lee Mark Men's Solid Formal Shirt,Clothing
Kairaa Lounge Wear Sleeveless Embellished Women's Top,Clothing
Soie Casual Sleeveless Solid Women's Top,Clothing
Hichkii Casual Cape Sleeve Embroidered Women's Top,Clothing
"Soie Casual, Festive, Formal, Lounge Wear, Party Sleeveless Solid Women's Top",Clothing
Clara Certified Katela 8.3 cts or 9.25 ratti Zoya Sterling Silver Amethyst Ring,Jewelry
Clara Certified Katela 6.5 cts or 7.25 ratti Elegant Sterling Silver Amethyst Ring,Jewelry
Clara Certified Katela 3.9 cts or 4.25 ratti Stunning Sterling Silver Amethyst Ring,Jewelry
SPECIES Striped Round Neck Women's Sweater,Clothing
Clara Certified Katela 6.5 cts or 7.25 ratti 4 Prongs Sterling Silver Amethyst Ring,Jewelry
Clara Certified Katela 5.5 cts or 6.25 ratti Elegant Sterling Silver Amethyst Ring,Jewelry
Clara Certified Katela 3 cts or 3.25 ratti 4 Prongs Sterling Silver Amethyst Ring,Jewelry
BlueStone The Princess Gold Diamond 18 K Ring,Jewelry
Varanga Casual Short Sleeve Printed Women's Top,Clothing
Orous Casual 3/4 Sleeve Printed Women's Top,Clothing
Lovelady Wedding Lingerie Set,Home & Kitchen
Nishtaa Yellow Gold Cubic Zirconia 22 K Ring,Jewelry
Jaune Women's Sheath Dress,Clothing
Living World by Home Stop Solid Wood Display Unit,Home & Kitchen
Status Quo Men's Solid Casual Shirt,Clothing
"Asian Gems & Jewels 6.25 Ratti 5 Dhaatu Sterling Silver, Metal, Alloy Cat's Eye NA K Ring",Jewelry
"Asian Gems & Jewels 5 Dhaatu Metal, Alloy Zircon Ring",Jewelry
"Sarva Casual, Party Sleeveless Self Design, Printed Women's Top",Clothing
"Sarva Party, Casual Sleeveless Self Design Women's Top",Clothing
PrettyPataka Party Full Sleeve Woven Women's Top,Clothing
"Sarva Party, Formal, Casual Sleeveless Embellished Women's Top",Clothing
"Tenn Casual, Party Sleeveless Floral Print Women's Top",Clothing
Maggie Party Sleeveless Floral Print Women's Top,Clothing
"Retaaz Casual, Party, Festive Sleeveless Floral Print Women's Top",Clothing
Bostan Running Shoes,Shoes
"Urban Fashion Bank Casual, Party, Festive, Lounge Wear Sleeveless Embellished Women's Top",Clothing
Wowww Casual Short Sleeve Solid Women's Top,Clothing
"Urban Fashion Bank Casual, Party, Festive, Lounge Wear Sleeveless Printed Women's Top",Clothing
Urban Fashion Bank Casual 3/4 Sleeve Solid Women's Top,Clothing
Hangover Solid Round Neck Women's Sweater,Clothing
Elson Self Design V-neck Women's Sweater,Clothing
WearYourShine by PCJ The Adriyel Gold Diamond 18 K Ring,Jewelry
"Asian Gems & Jewels 5.25 Ratti 5 Dhaatu Sterling Silver, Metal, Alloy Coral Ring",Jewelry
TeeMoods Casual Full Sleeve Striped Women's Top,Clothing
Colbrii Casual Full Sleeve Printed Women's Top,Clothing
"KuberBox Ravishing Ring White Gold Diamond, Topaz 14K White Gold 14 K Ring",Jewelry
My Addiction Casual Full Sleeve Embroidered Women's Top,Clothing
"SFDS Casual, Formal, Party Full Sleeve Printed Women's Top",Clothing
"Membooz Casual, Party Short Sleeve Self Design Women's Top",Clothing
Sheezworld Casual Full Sleeve Self Design Women's Top,Clothing
Karatcraft Wadell Gold Diamond 18 K Ring,Jewelry
Karatcraft Twinoh Gold Diamond 18 K Ring,Jewelry
Karatcraft Clariz Gold Diamond 18 K Ring,Jewelry
Herberto Girl's A-line Dress,Clothing
Karatcraft Solitana Gold Diamond 18 K Ring,Jewelry
Karatcraft Celebra Gold Diamond 18 K Ring,Jewelry
Kids On Board Girl's Gathered Dress,Clothing
ABHIRA Girl's A-line Dress,Clothing
Herberto Girl's High Low Dress,Clothing
Fasense Women's Nighty,Clothing
Megha Casual Short Sleeve Printed Women's Top,Clothing
Karatcraft Duilla Ruby Gold Diamond 18 K Ring,Jewelry
Karatcraft Journa Gold Diamond 18 K Ring,Jewelry
CaratLane Fantasia Band White Gold Diamond 18 K Ring,Jewelry
Karigaari Set Of 5 Adivasi Doing Merry On Trumpet Showpiece  -  30 cm,CDs & Vinyl
WearYourShine by PCJ The Sharman Gold Diamond 18 K Ring,Jewelry
"SFDS Casual, Formal, Party Short Sleeve Self Design Women's Top",Clothing
"SFDS Casual, Formal, Party Sleeveless Self Design Women's Top",Clothing
Totta Pouch for Sony Xperia M5 Dual,Electronics
"Kalakruti K Jewellery B Jewelry box, Makeup Vanity Multi Purpose",Beauty
Karatcraft Trilic Gold Diamond 18 K Ring,Jewelry
YNA Aviator Sunglasses,Accessories
Ditu&Kritu Warrior Aviator Sunglasses,Sports & Outdoors
American Crew Solid Women's Track Pants,Clothing
Allen Solly Girl's Gathered Dress,Clothing
Abr Casual Shoes,Shoes
Allen Solly Girl's A-line Dress,Clothing
Allen Solly Girl's Shift Dress,Clothing
Petals Girl's Gathered Dress,Clothing
Allen Solly Girl's Layered Dress,Clothing
Karatcraft Donna Gold Diamond 18 K Ring,Jewelry
Absurd Full Sleeve Solid Men's Sweatshirt,Clothing
Escocer Women's Leggings,Clothing
Absurd Full Sleeve Solid Men's Reversible Sweatshirt,Clothing
Selfcare Soft & Comfortable Newly Launched Girl's Top - Pyjama Set,Clothing
WearYourShine by PCJ The Melina Gold Diamond 18 K Ring,Jewelry
WearYourShine by PCJ The Radelle Diamond Gold Diamond Yellow Gold 18 K Ring,Jewelry
WearYourShine by PCJ The Helaine Gold Diamond 18 K Ring,Jewelry
Ozel Studio Casual 3/4 Sleeve Solid Women's Top,Clothing
Ozel Studio Casual Sleeveless Solid Women's Top,Clothing
Shopaholic Casual 3/4 Sleeve Solid Women's Top,Clothing
Fashion Flow+ Women's Leggings,Clothing
Ozel Studio Casual Short Sleeve Solid Women's Top,Clothing
Ozel Studio Casual Full Sleeve Solid Women's Top,Clothing
Shilpi Casual Cape Sleeve Solid Women's Top,Clothing
Yepme Casual Short Sleeve Solid Women's Top,Clothing
CaratLane Swish Ray White Gold Diamond 18 K Ring,Jewelry
WearYourShine by PCJ The Maryse Diamond Gold Diamond Yellow Gold 18 K Ring,Jewelry
Claude Lorrain Black Casuals Shoes,Shoes
Steppings Running Shoes Casuals Shoes,Shoes
Steppings Wedges Casuals Shoes,Shoes
Bonzer Bellies,Toys & Games
Araanz by Tribhovandas Bhimji Zaveri Delhi Gold Diamond 18K Yellow Gold 18 K Ring,Jewelry
Gritstones Solid Women's Track Pants,Clothing
Tapyti Casual Sleeveless Solid Women's Top,Clothing
Tapyti Casual Short Sleeve Solid Women's Top,Clothing
Tapyti Casual 3/4 Sleeve Solid Women's Top,Clothing
United Colors of Benetton Solid Round Neck Casual Women's Sweater,Clothing
BlueStone The Twin Wingflow Yellow Gold Diamond 18 K Ring,Home & Kitchen
Ozel Studio Casual Full Sleeve Printed Women's Top,Clothing
Ozel Studio Casual Sleeveless Printed Women's Top,Clothing
WearYourShine by PCJ The Skyrah Gold Diamond 18 K Ring,Jewelry
WearYourShine by PCJ The Dawnetta Gold Diamond 18 K Ring,Jewelry
The Clove Casual 3/4 Sleeve Striped Women's Top,Clothing
Nun Casual Full Sleeve Striped Women's Top,Clothing
Moda Vastra Casual 3/4 Sleeve Graphic Print Women's Top,Clothing
Cation Casual 3/4 Sleeve Solid Women's Top,Clothing
Cation Casual Short Sleeve Solid Women's Top,Clothing
"Cation Casual Short Sleeve, 3/4 Sleeve Solid Women's Top",Clothing
Fundoo T Full Sleeve Solid Men's Sweatshirt,Clothing
Cation Casual 3/4 Sleeve Printed Women's Top,Clothing
Goddess Women Casual 3/4 Sleeve Solid Women's Top,Clothing
BownBee Girl's Gathered Dress,Clothing
Jewels Of Jaipur Gold Ruby Yellow Gold 14 K Ring,Jewelry
"BlueStone The Ziva Yellow Gold Diamond, Emerald 18 K Ring",Jewelry
United Colors of Benetton Striped Round Neck Casual Women's Sweater,Clothing
Tapyti Casual Full Sleeve Solid Women's Top,Clothing
Only Party Short Sleeve Solid Women's Top,Clothing
Elisabetta Bartolli Party Short Sleeve Solid Women's Top,Clothing
MSL Women Flats,Shoes
Tapyti Party Sleeveless Solid Women's Top,Clothing
JDX Plain Bed/Sleeping Pillow,Home & Kitchen
DailyObjects Back Cover for iPad Mini/Retina Display,Electronics
Life by Shoppers Stop Women's Gathered Dress,Clothing
Kiara Jewellery Sterling Silver Cubic Zirconia Rhodium Ring,Jewelry
Calgari Women's Gathered Dress,Clothing
Dumdaar.com Women's Gathered Dress,Clothing
Kiara Jewellery Silver Cubic Zirconia Rhodium Ring,Jewelry
Krasns Couture Formal Sleeveless Solid Women's Top,Clothing
Forever Fashion Casual Sleeveless Solid Women's Top,Clothing
Ishtaa Gold Cubic Zirconia 18 K Ring,Jewelry
Selfcare Soft & Comfortable Newly Launched Girl's Top,Clothing
