Product Name,Categories
Olvin Aviator Sunglasses,Accessories
TSG Breeze Printed Women's Round Neck Multicolor T-Shirt,Clothing
Pout Brass Bangle,"Arts, Crafts & Sewing"
Dilan Jewels Alloy Crystal 18K Yellow Gold Bangle Set,Jewelry
AdroitZ Exclusive Barbie Doll Sunshade / curtain (set of 2) for Tata Indigo eCS Sun Shade For Tata Indigo,Toys & Games
AdroitZ Exclusive Barbie Doll Sunshade / curtain (set of 2) for Fiat Punto Sun Shade For Fiat Punto,Toys & Games
Lilliput Girl's Blue Dungaree,Clothing
classyworld Brass Cufflink,Jewelry
HANS Men's Crew Length Socks,Clothing
Rugby Slippers,Sports & Outdoors
NEWGEN TECH EO-HS3303 67 Wired Headset,Electronics
Olvin Oval Sunglasses,Accessories
Chickraft Wood Bangle,"Arts, Crafts & Sewing"
"Firangi Cotton, Polyester Free Floor Mat Firangi Designer Diamond Door Mat",Home & Kitchen
TIMBERLAKE Slim Fit Fit Women's Brown Jeans,Clothing
Ajaero Slim Fit Women's Blue Jeans,Clothing
AdroitZ Exclusive Barbie Doll Sunshade / curtain (set of 2) for Honda Amaze Sun Shade For Honda Amaze,Toys & Games
Starsy Printed Women's Round Neck Green T-Shirt,Clothing
NEWGEN TECH EO-HS3303 171 Wired Headset,Electronics
Urban Girl Foundation Brush,Beauty
FEET FLOW Women Flats,Sports & Outdoors
"Metro Sports Leather Cricket Ball -   Size: 5,  Diameter: 23 cm",Sports & Outdoors
Jazz Eyewears Over-sized Sunglasses,Sports & Outdoors
NEWGEN TECH EO-HS3303 166 Wired Headset,Electronics
AdroitZ Exclusive Barbie Doll Sunshade / curtain (set of 2) for Chevrolet Sail type 2 Sun Shade For Chevrolet Sail,Toys & Games
Miss Wow Slim Fit Women's Blue Jeans,Clothing
Zidane 503TF_BLK Wireless Bluetooth Headset,Cell Phones & Accessories
Dilan Jewels Alloy Zircon 18K Yellow Gold Bangle,Jewelry
Clovia Women's Full Coverage Bra,Clothing
SMART TRADERS Women Wedges,Clothing
Viral Girl Women's Full Coverage Bra,Clothing
"Shopfloor.XYZ Vacuum Cleaner for Computers, Laptops, Mobiles",Electronics
Dilan Jewels Alloy Zircon 18K Yellow Gold Bangle Set,Jewelry
NEWGEN TECH EO-HS3303 154 Wired Headset,Electronics
PrivateLifes MasterPiece Women's Push-up Bra,Clothing
Body Balance Imon Energy Wristband,Health & Personal Care
COIRFIT Single Coir Mattress,Home & Kitchen
CHKOKKO Earbud Skin Wireless Bluetooth Headset,Cell Phones & Accessories
NEWGEN TECH EO-HS3303 55 Wired Headset,Electronics
Skywalk Flip Flops,Shoes
Blinkin Girl's Blue Dungaree,Clothing
Clovia Women's T-Shirt Bra,Clothing
Spa Culture Fit Fit Women's Black Jeans,Clothing
run of luck Solid Women's Round Neck Dark Blue T-Shirt,Clothing
SAY UV Sterilizer Solid Filter Cartridge,Home & Kitchen
AdroitZ Exclusive Barbie Doll Sunshade / curtain (set of 2) for Ford Fiesta Sun Shade For Ford Fiesta,Toys & Games
e-Fresh Boy's Brief,Clothing
Qline Superman Wired Headset,Cell Phones & Accessories
Legmark Slim Fit Women's Light Blue Jeans,Clothing
Siyas Collection Lac Cubic Zirconia Bangle Set,Jewelry
Dassler Slim Fit Women's Multicolor Jeans,Clothing
SLS Slim Fit Women's Blue Jeans,Clothing
Palakz Printed Foldable Storage Stool,Home & Kitchen
AdroitZ Exclusive Barbie Doll Sunshade / curtain (set of 2) for Nissan Micra Sun Shade For Nissan Micra,Automotive
Yellow Pingo Girl's Blue Dungaree,Clothing
NEWGEN TECH EO-HS3303 186 Wired Headset,Electronics
"Naughty Ninos Girl's White, Pink Dungaree",Clothing
REMSON INDIA Women Flats,Clothing
Penny jewels Alloy Beads Brass Bangle Set,"Arts, Crafts & Sewing"
INDILEGO Women Flats,Shoes
NEWGEN TECH EO-HS3303 64 Wired Headset,Electronics
"Firangi Cotton, Polyester Free Floor Mat Firangi Designer Strips Door Mat",Home & Kitchen
Flipside Flip Flops,Shoes
NEWGEN TECH EO-HS3303 176 Wired Headset,Electronics
Naaz The Young Scientist for kids Board Game,Toys & Games
EGON 7512_TM_P Faucet Set,Home & Kitchen
Starsy Solid Women's Round Neck Green T-Shirt,Clothing
SDZ Pisten Design Pure Metal Silver Series Wired Headset,Cell Phones & Accessories
NEWGEN TECH EO-HS3303 187 Wired Headset,Electronics
Oly Two Fit Fit Women's Black Jeans,Clothing
Olvin Rectangular Sunglasses,Accessories
fourgee Slim Fit Women's Black Jeans,Clothing
AdroitZ Exclusive Barbie Doll Sunshade / curtain (set of 2) for Hyundai Verna type 1 Sun Shade For Hyundai Verna,Automotive
soie Fashion Women's Sports Bra,Clothing
"Auraa Men's, Women's Solid No Show Socks",Clothing
CrayonFlakes Baby Girl's Pyjama,Clothing
Furnishing Zone Plain Back Cushion,Home & Kitchen
AdroitZ Exclusive Barbie Doll Sunshade / curtain (set of 2) for Maruti Zen Estilo Sun Shade For Maruti Zen Estilo,Toys & Games
"Firangi Cotton, Polyester Free Floor Mat Firangi Linear Fur Design Door Mat",Home & Kitchen
AdroitZ Exclusive Barbie Doll Sunshade / curtain (set of 2) for Renault Fluence Sun Shade For Renault Fluence,Toys & Games
AdroitZ Exclusive Barbie Doll Sunshade / curtain (set of 2) for Maruti Alto K-10 Sun Shade For Maruti Alto K10,Toys & Games
NEWGEN TECH EO-HS3303 172 Wired Headset,Electronics
NEWGEN TECH EO-HS3303 194 Wired Headset,Electronics
NEWGEN TECH EO-HS3303 179 Wired Headset,Electronics
Attitude Printed Women's Round Neck Black T-Shirt,Clothing
Kalpaveda Copper Bowl,Home & Kitchen
Walkline Slippers,Shoes
AdroitZ Exclusive Barbie Doll Sunshade / curtain (set of 2) for Tata Safari Dicor Sun Shade For Tata Safari,Toys & Games
NEWGEN TECH EO-HS3303 144 Wired Headset,Electronics
NEWGEN TECH EO-HS3303 161 Wired Headset,Electronics
Naaz International Buisness Game Board Game,Toys & Games
"Chickraft Alloy, Metal, Glass Bangle","Arts, Crafts & Sewing"
D&D Women Flats,Shoes
AdroitZ Exclusive Barbie Doll Sunshade / curtain (set of 2) for Maruti Wagon-R type 3 Sun Shade For Maruti WagonR,Toys & Games
e-Fresh Baby Boy's Brief,Clothing
NEWGEN TECH EO-HS3303 58 Wired Headset,Electronics
Clovia Women's Sports Bra,Clothing
AdroitZ Exclusive Barbie Doll Sunshade / curtain (set of 2) for Tata Indigo V2 Small Sun Shade For Tata Indigo,Toys & Games
Hitobito Full Sleeve Solid Women's Jacket,Clothing
Ajaero Slim Fit Women's Dark Blue Jeans,Clothing
Woly Smooth Leather Shoe Cream,Health & Personal Care
AdroitZ Exclusive Barbie Doll Sunshade / curtain (set of 2) for Tata Indica small type 2 Sun Shade For Tata Indica,Toys & Games
Ruhi's Creations Cotton Floral King sized Double Bedsheet,Home & Kitchen
"SAY Thread Wounded Candle 10"" Set of 4 pcs Solid Filter Cartridge",Home & Kitchen
METMO Slippers,Shoes
The Cotton Company Solid Women's Polo Neck Pink T-Shirt,Clothing
Samprada Modern art Tapestry,Home & Kitchen
Naaz Dart game Board Game,Toys & Games
Oly Two Fit Fit Women's Dark Blue Jeans,Clothing
AdroitZ Exclusive Barbie Doll Sunshade / curtain (set of 2) for Maruti Alto K-10 New Sun Shade For Maruti Alto K10,Toys & Games
Camey Men's Quarter Length Socks,Clothing
SIESTA Slim Fit Women's Black Jeans,Clothing
AdroitZ Exclusive Barbie Doll Sunshade / curtain (set of 2) for Maruti Ritz Sun Shade For Maruti Ritz,Toys & Games
Ajaero Slim Fit Women's Light Blue Jeans,Clothing
Colour Me Mad Flip Flops,Sports & Outdoors
AdroitZ Exclusive Barbie Doll Sunshade / curtain (set of 2) for Ford Figo Sun Shade For Ford Figo,Toys & Games
Wellon Fittings set (16 pieces) for RO Water Purifier Solid Filter Cartridge,Home & Kitchen
Bells and Whistles Girl's Blue Dungaree,Toys & Games
Evana Amazing Unisex Stainless-Steel Push-up Bar,Sports & Outdoors
Amita Home Furnishing Cotton Printed Single Bedsheet,Home & Kitchen
LRB Slippers,Shoes
Impala Alloy Cufflink,Sports & Outdoors
Sonpra Men's Mid-calf Length Socks,Clothing
Ruhi's Creations Polyester Silk Blend Cartoon King sized Double Bedsheet,Home & Kitchen
DOCOSS PACK OF 3-speed Jet Spray & Anox 1.5 meter Shower Tube Health Faucet Set,Tools & Home Improvement
INDOART Wooden Spatula,Home & Kitchen
AdroitZ Exclusive Barbie Doll Sunshade / curtain (set of 2) for Skoda Fabia Sun Shade For Skoda Fabia,Toys & Games
Naaz 2 in 1 Paper Quilling Board Game,Toys & Games
Clovia Women's Tube Bra,Clothing
cherry crumble california Girl's Pink Dungaree,Home & Kitchen
Moladz Flip Flops,Shoes
People 3/4 Sleeve Solid Women's Jacket,Clothing
Twin Slippers,Home & Kitchen
AdroitZ Exclusive Barbie Doll Sunshade / curtain (set of 2) for Tata Indica small type 3 Sun Shade For Tata Indica,Toys & Games
Starsy Printed Women's Round Neck Black T-Shirt,Clothing
Fly U Slim Fit Fit Women's Brown Jeans,Clothing
Crafty Hands Kutchchi Mirrorwork Tapestry,"Arts, Crafts & Sewing"
AdroitZ Exclusive Barbie Doll Sunshade / curtain (set of 2) for Toyota Innova type 3 small Sun Shade For Toyota Innova,Automotive
"tadd Men's, Women's Ankle Length Socks",Clothing
AdroitZ Exclusive Barbie Doll Sunshade / curtain (set of 2) for Toyota Corolla Altis Sun Shade For Toyota Corolla,Automotive
Naughty Ninos Girl's Pink Dungaree,Clothing
Ritco lhst2 Faucet Set,Tools & Home Improvement
AdroitZ Exclusive Barbie Doll Sunshade / curtain (set of 2) for Fiat Linea Sun Shade For Fiat Linea,Toys & Games
Starsy Printed Women's Round Neck White T-Shirt,Clothing
Dolz Slim Fit Fit Women's Brown Jeans,Clothing
DOLZ Skinny Fit Fit Women's Brown Jeans,Clothing
AdroitZ Exclusive Barbie Doll Sunshade / curtain (set of 2) for Chevrolet Sail type 1 Sun Shade For Chevrolet Sail,Toys & Games
Naaz Tic Tac Toe mini Board Game,Toys & Games
Shrih Toe & Foot Protector Pain Relief Pad,Health & Personal Care
My Lil' Berry Girl's Blue Dungaree,Toys & Games
Reebok Solid Men's Three Fourths,Clothing
AdroitZ Exclusive Barbie Doll Sunshade / curtain (set of 2) for Hyundai Verna type 2 Sun Shade For Hyundai Verna,Automotive
AdroitZ Exclusive Barbie Doll Sunshade / curtain (set of 2) for Honda Civic Sun Shade For Honda Civic,Automotive
Nivea Sensitive Shaving Cream,Health & Personal Care
LondonHouze Printed Women's Round Neck Grey T-Shirt,Clothing
Fisher-Price Baby Girl's Orange Leggings,Toys & Games
Legmark Slim Fit Women's Blue Jeans,Clothing
Ritco rslpf3 Faucet Set,Tools & Home Improvement
PEDI SPIN FP-156892,Health & Personal Care
Linzina Fashions LIN-HOSS-1.5 Faucet Set,Tools & Home Improvement
Naaz Manicure Pedicure Kit For Kids and adult Board Game,Health & Personal Care
ELLE Girl's Red Romper,Clothing
soie Fashion Women's Full Coverage Bra,Clothing
Clovia Women's Plunge Bra,Clothing
Ritco rsacf5 Faucet Set,Tools & Home Improvement
Black & Decker SB3220 500 W Hand Blender,Home & Kitchen
AdroitZ Exclusive Barbie Doll Sunshade / curtain (set of 2) for Toyota Liva Sun Shade For Toyota Etios Liva,Toys & Games
MIRICHI Printed Women's Polo Neck Red T-Shirt,Clothing
"Firangi Cotton, Polyester Free Floor Mat Firangi Decorative Loopy Door Mat",Home & Kitchen
Foot Candy Women Flats,Shoes
AdroitZ Exclusive Barbie Doll Sunshade / curtain (set of 2) for Volkswagen Polo type 2 Sun Shade For Volkswagen Polo,Toys & Games
AdroitZ Exclusive Barbie Doll Sunshade / curtain (set of 2) for Maruti Wagon-R type 2 Sun Shade For Maruti WagonR,Toys & Games
Amita Home Furnishing Cotton Floral Single Bedsheet,Home & Kitchen
Babyoye Premium Baby Girl's Grey Leggings,Clothing
883 Police Full Sleeve Solid Men's Jacket,Sports & Outdoors
AdroitZ Exclusive Barbie Doll Sunshade / curtain (set of 2) for Mahindra Bolero Sun Shade For Mahindra Bolero,Toys & Games
Style World Women Flats,Clothing
Just Wow Women Flats,Clothing
"Firangi Cotton, Polyester Free Floor Mat Firangi Decorative TRD Fur Door Mat",Home & Kitchen
Furnishing Zone Printed Back Cushion,Home & Kitchen
Babyoye Premium Baby Girl's Multicolor Leggings,Clothing
"Arcley ARC INSPIRE CROP Nylon, Polyester Yoga Strap",Sports & Outdoors
SMART TRADERS Women Flats,Clothing
AdroitZ Exclusive Barbie Doll Sunshade / curtain (set of 2) for Skoda Rapid Sun Shade For Skoda Rapid,Toys & Games
"NESTWELL HAND BLENDER EGG,LASSI,BUTTER,MILK,JUICE LIQUIDIZING 0 W Hand Blender",Home & Kitchen
Naughty Ninos Girl's Multicolor Romper,Clothing
GREENWICH Baby Girl's Black Jeggings,Clothing
AdroitZ Exclusive Barbie Doll Sunshade / curtain (set of 2) for Honda city type 3 Sun Shade For Honda City,Toys & Games
AdroitZ Exclusive Barbie Doll Sunshade / curtain (set of 2) for Maruti Ciaz Sun Shade For Maruti Ciaz,Toys & Games
AdroitZ Exclusive Barbie Doll Sunshade / curtain (set of 2) for Tata Indica eV2 Sun Shade For Tata Indica,Toys & Games
Ruhi's Creations Cotton Cartoon King sized Double Bedsheet,Home & Kitchen
Decore Sources Assorted Artificial Plant  with Pot,"Patio, Lawn & Garden"
Wadhwa creations Car Cover For Innova,Automotive
Go Hooked Bonsai Assorted Artificial Plant  with Pot,"Patio, Lawn & Garden"
Miracle Retail Bonsai Wild Plant Artificial Plant  with Pot,"Patio, Lawn & Garden"
"Mayursflora Bonsai Aloe, Maple, Arecaceae, Palm, Maguey Artificial Plant  with Pot","Patio, Lawn & Garden"
SmartShophar Brass Wall Hook Keys 4 Leg Antique,Tools & Home Improvement
Subh-Akriti Assorted Artificial Plant,Grocery & Gourmet Food
TAKE CARE T995 Plastic Gear Knob,Toys & Games
Raaisin Dupont Tyvek Car Cover For Passat,Automotive
CarMobCentral Car Cover For Ritz,Cell Phones & Accessories
Raaisin Dupont Tyvek Car Cover For Astra,Automotive
TAKE CARE T920 Plastic Gear Knob,Toys & Games
V Creations Bonsai Cactus Artificial Plant  with Pot,"Patio, Lawn & Garden"
Wadhwa creations Car Cover For CR-V,Automotive
Wadhwa creations Car Cover For Polo,Automotive
TPH Covers Agile Car Cover For NA,Automotive
TAKE CARE T943 Plastic Gear Knob,Toys & Games
TAKE CARE T8648 Plastic Gear Knob,Toys & Games
Vheelocityin Car Cover For Vento,Automotive
kea Girl's Vest,Clothing
nayasa whip 1200 ml Bottle,Health & Personal Care
LITTLE FEETZ Baby Girl's Solid Top & Skirt Set,Clothing
Selfiwear Printed Cotton Men's Stole,Clothing
Saco Karbonn Smart Ta Fone A37 Hd Tablet Wired USB Tablet Keyboard,Electronics
TSG Escape Printed Men's Round Neck Multicolor T-Shirt,Clothing
US Polo Striped Casual Boy's Sweater,Clothing
Fritzberg Printed Men's Round Neck T-Shirt,Clothing
Fritzberg Graphic Print Men's Round Neck T-Shirt,Clothing
His & Her Gold Diamond 18K Yellow Gold 18 K Ring,Jewelry
"Klick Casual, Formal, Party Sleeveless Solid Women's Top",Clothing
Jacknjewel Classical White Gold Diamond 18 K Ring,Jewelry
Jacknjewel Winsome White Gold Diamond 18 K Ring,Home & Kitchen
"Klick Casual 3/4 Sleeve Solid, Self Design Women's Top",Clothing
Jacknjewel Charming Six Stone White Gold Diamond 18 K Ring,Jewelry
Jacknjewel Exquisite White Gold Diamond 18 K Ring,Jewelry
G & M Collections Striped Women's A-line Skirt,Clothing
YOUTH GARB Full Sleeve Embellished Men's Sweatshirt,Sports & Outdoors
Poetry Accessories Zinc Jewel Set,Home & Kitchen
iWonder Printed Women's A-line Skirt,Clothing
Campus Sutra Full Sleeve Printed Men's Sweatshirt,Clothing
Shashvat Jewels Designer & Elegant Silver Jewel Set,Jewelry
Iamyou Casual 3/4 Sleeve Solid Women's Top,Clothing
Superdry Self Design Women's Round Neck T-Shirt,Clothing
Reebok Printed Women's Round Neck T-Shirt,Clothing
Quechua Solid Women's Round Neck T-Shirt,Clothing
"TeeMoods Casual Butterfly Sleeve, Short Sleeve Solid Women's Top",Clothing
Latin Quarters Casual Butterfly Sleeve Self Design Women's Top,Clothing
TeeMoods Casual Butterfly Sleeve Solid Women's Top,Clothing
Gnist Women Heels,Shoes
Tops And Tunics Casual Butterfly Sleeve Solid Women's Top,Clothing
Hepburnette Women Heels,Shoes
Royal Collection Women Heels,Sports & Outdoors
Via Italia Girl's Layered Dress,Clothing
Bells And Whistles Girl's Layered Dress,Clothing
Next Steps Baby Girl's Layered Dress,Clothing
Perky Girl's Layered Dress,Clothing
Bells and Whistles Girl's A-line Dress,Toys & Games
"TSG Breeze Casual Sleeveless Solid, Printed Women's Top",Clothing
TSG Breeze Casual Short Sleeve Embroidered Women's Top,Clothing
Kazo Casual Short Sleeve Printed Women's Top,Clothing
Veakupia Casual Sleeveless Solid Women's Top,Clothing
"TSG Breeze Casual Sleeveless, Short Sleeve Solid, Embellished Women's Top",Clothing
Veakupia Casual Sleeveless Floral Print Women's Top,Clothing
Oasis Wayfarer Sunglasses,Accessories
Radiant Bay Blend Yellow Gold Diamond 18 K Ring,Sports & Outdoors
Jewels5 Daliah Yellow Gold Diamond 18 K Ring,Jewelry
Jewels5 Tanessa Yellow Gold Diamond 18 K Ring,Jewelry
BlueStone The Aru White Gold Diamond 14 K Ring,Jewelry
BlueStone The Triple Radiance White Gold Diamond 14 K Ring,Home & Kitchen
TSX Full Sleeve Solid Men's Sweatshirt,Clothing
Rann Women's Leggings,Clothing
Addline Women's Leggings,Clothing
People Casual Sleeveless Striped Women's Top,Clothing
People Casual Short Sleeve Printed Women's Top,Clothing
Rose Vanessa Casual 3/4 Sleeve Printed Women's Top,Clothing
Colors Couture Casual 3/4 Sleeve Solid Women's Top,Clothing
Colors Couture Casual Sleeveless Solid Women's Top,Clothing
Colors Couture Casual Full Sleeve Solid Women's Top,Clothing
Colors Couture Casual Sleeveless Printed Women's Top,Clothing
Rute Casual Sleeveless Embellished Women's Top,Clothing
Kairaa Casual Sleeveless Embellished Women's Top,Clothing
Noble Faith Casual Sleeveless Embellished Women's Top,Clothing
Oxolloxo Casual Sleeveless Embellished Women's Top,Clothing
Urban Misty Casual Sleeveless Embellished Women's Top,Clothing
CampusMall Printed Men's Round Neck T-Shirt,Clothing
CaratLane Twirl Tangle Yellow Gold Diamond 18 K Ring,Jewelry
Herberto Girl's Layered Dress,Clothing
Calgari Casual 3/4 Sleeve Solid Women's Top,Clothing
Calgari Casual Full Sleeve Solid Women's Top,Clothing
Nineteen Casual Sleeveless Solid Women's Top,Clothing
i-KitPit Pouch for iPhone 5 / 5S,Cell Phones & Accessories
CaratLane Jesyln Yellow Gold Diamond 18 K Ring,Jewelry
Puma Printed Women's Round Neck T-Shirt,Clothing
BlueStone The Ema Yellow Gold Diamond 18 K Ring,Jewelry
De Moza Casual Full Sleeve Solid Women's Top,Clothing
Savie Shoes Sneakers,Shoes
Albely Casual Short Sleeve Solid Women's Top,Clothing
Pannkh Casual Short Sleeve Solid Women's Top,Clothing
Instinct Casual Short Sleeve Solid Women's Top,Clothing
"SFDS Casual, Formal, Party Short Sleeve Solid Women's Top",Clothing
Sprint Men's Checkered Formal Shirt,Clothing
Nun Printed Women's Broomstick Skirt,Clothing
The Modern Knitting Shop Women's Leggings,Clothing
Van Heusen Men's Striped Formal Shirt,Clothing
"Yutak Solid, Embellished Women's V-neck T-Shirt",Clothing
DFR Women Flats,Shoes
Sobre Estilo Full Sleeve Solid Men's Sweatshirt,Sports & Outdoors
Scott International Full Sleeve Solid Men's Sweatshirt,Sports & Outdoors
Noble Faith Casual Full Sleeve Solid Women's Top,Clothing
Noble Faith Casual Sleeveless Printed Women's Top,Clothing
Fox Printed Women's V-neck T-Shirt,Clothing
The Vanca Formal 3/4 Sleeve Printed Women's Top,Clothing
The Vanca Formal Short Sleeve Printed Women's Top,Clothing
Veakupia Casual Full Sleeve Solid Women's Top,Clothing
"TSG Breeze Casual Short Sleeve Solid, Embellished Women's Top",Clothing
Vero Moda Casual Full Sleeve Printed Women's Top,Clothing
Vero Moda Casual 3/4 Sleeve Embellished Women's Top,Clothing
Park Avenue Sleeveless Solid Men's Jacket,Clothing
Allen Solly Casual Sleeveless Solid Women's Top,Clothing
Cation Casual Full Sleeve Solid Women's Top,Clothing
GraceDiva Printed Women's Gathered Skirt,Clothing
Fashionite Casual Short Sleeve Embellished Women's Top,Clothing
Ir Acc Casual Roll-up Sleeve Self Design Women's Top,Clothing
Ir Acc Casual 3/4 Sleeve Solid Women's Top,Clothing
Kaizer Jewelry Stainless Steel Zircon Ring,Jewelry
i-KitPit Pouch for Lenovo A369i,Electronics
Wow Pouch for Lenovo A369i,Electronics
Puma Casual Short Sleeve Solid Women's Top,Clothing
Puma Casual Short Sleeve Printed Women's Top,Clothing
Puma Sports Women's Top,Sports & Outdoors
BlueStone The Venera Yellow Gold Diamond 14 K Ring,Jewelry
Reebok Printed Women's V-neck T-Shirt,Clothing
JacknJewel Enchanting Yellow Gold Diamond 18K Yellow Gold 18 K Ring,Jewelry
Buenos Dias Casual Short Sleeve Solid Women's Top,Clothing
Sugar Her Casual Full Sleeve Solid Women's Top,Clothing
Elisabetta Bartolli Party Sleeveless Solid Women's Top,Clothing
Ciemme 0.11 CT Fashion Forever Love Promise Yellow Gold Diamond 18 K Ring,Jewelry
Ciemme 0.09 CT Fashion Designer Women's Promise Yellow Gold Diamond 18 K Ring,Jewelry
Ciemme 0.11 CT Women's Designer Circle Flower Promise Yellow Gold Diamond 18 K Ring,Jewelry
Ciemme 0.09 CT Fancy Split Shank Women's Promise Yellow Gold Diamond 18 K Ring,Jewelry
Ciemme 0.08 CT Women's Circle Of Love Relation Promise Yellow Gold Diamond 18 K Ring,Jewelry
Ciemme 0.10 CT Sign OF True Love Women's Promise Yellow Gold Diamond 18 K Ring,Jewelry
Ciemme 0.11 CT Fashion Twisted Marquise Shape Women's Promise Yellow Gold Diamond 18 K Ring,Jewelry
Ciemme 0.11 CT Fashion Women's Flower Promise Yellow Gold Diamond 18 K Ring,Jewelry
BMS Lifestyle Wallet Case Cover for Apple ipad Mini 2,Cell Phones & Accessories
"Cation Casual Sleeveless, Short Sleeve Solid Women's Top",Clothing
BMS Lifestyle Wallet Case Cover for Apple ipad Mini,Cell Phones & Accessories
BMS Lifestyle Wallet Case Cover for Apple ipad Mini 3,Cell Phones & Accessories
BMS Lifestyle Book Cover for Apple iPad 2,Electronics
BMS Lifestyle Book Cover for Apple iPad 3,Electronics
BMS Lifestyle Book Cover for Apple iPad 4,Electronics
Tantra Graphic Print Men's Round Neck T-Shirt,Clothing
"Cation Casual 3/4 Sleeve, Short Sleeve Solid Women's Top",Clothing
Leebonee Women's Leggings,Clothing
Mast & Harbour Full Sleeve Solid Women's Jacket,Clothing
Dewberries Formal 3/4 Sleeve Solid Women's Top,Clothing
Dewberries Formal Short Sleeve Self Design Women's Top,Clothing
"Limeberry Striped, Solid Women's Round Neck, V-neck T-Shirt",Clothing
U&F Women's Maxi Dress,Clothing
No Code Party Full Sleeve Solid Women's Top,Clothing
Rene Casual Short Sleeve Solid Women's Top,Clothing
Miss Chase Casual Full Sleeve Solid Women's Top,Clothing
Zink London Casual Short Sleeve Solid Women's Top,Clothing
Kidzy Casuals Shoes,Shoes
Meish Casual Short Sleeve Embellished Women's Top,Clothing
Van Heusen Casual Short Sleeve Embellished Women's Top,Clothing
Pindia Casual Short Sleeve Embellished Women's Top,Clothing
CaratLane Twin Sparkle Gold Diamond 18 K Ring,Jewelry
Feneto Women's Solid Casual Shirt,Clothing
Qbee Women's Solid Casual Shirt,Clothing
Beevee Printed Men's Three Fourths,Clothing
Akfoster Women's Leggings,Clothing
Zink London Casual Sleeveless Solid Women's Top,Clothing
Zink London Casual Full Sleeve Printed Women's Top,Clothing
Today Fashion Casual 3/4 Sleeve Solid Women's Top,Clothing
Highlander Men's Solid Casual Shirt,Clothing
Highlander Men's Printed Casual Shirt,Clothing
MK Teddy Minion double eye  - 35 cm,Toys & Games
WearYourShine by PCJ The Charles Gold Diamond 18 K Ring,Toys & Games
WearYourShine by PCJ The Hyun Gold Diamond 18 K Ring,Jewelry
Imbindass Printed Men's Round Neck T-Shirt,Clothing
Leo Clothing Printed Men's Round Neck T-Shirt,Clothing
Priknit Full Sleeve Solid Men's Jacket,Clothing
Pulpypapaya Sleeveless Printed Men's Jacket,Clothing
Jogur Full Sleeve Solid Men's Jacket,Clothing
Sports 52 Wear Full Sleeve Solid Men's Jacket,Clothing
The Curve Full Sleeve Solid Men's Quilted Jacket,Clothing
Pannkh Self Design Single Breasted Casual Women's Blazer,Clothing
Jacknjewel Enchanting White Gold Diamond 18 K Ring,Jewelry
Pannkh Printed Single Breasted Casual Women's Blazer,Clothing
Chimp Graphic Print Men's Round Neck T-Shirt,Clothing
WearYourShine by PCJ The Brietta Gold Diamond 18 K Ring,Jewelry
"Royal Diamond Jewellery Charisma Gold, Yellow Gold Diamond Yellow Gold 14 K Ring",Jewelry
Wrangler Solid Turtle Neck Casual Men's Sweater,Clothing
Alluring Silver Swarovski Crystal Ring,Jewelry
WearYourShine by PCJ The Nitza Diamond Gold Diamond Yellow Gold 18 K Ring,Jewelry
WearYourShine by PCJ The Ramizah Diamond Gold Diamond Yellow Gold 18 K Ring,Jewelry
ALLURING Silver Swarovski Crystal Rhodium NA K Ring,Jewelry
Alluring Silver Swarovski Crystal Rhodium Ring,Jewelry
ACM Pouch for Oneplus One,Cell Phones & Accessories
Metro Active Casual Shoes,Sports & Outdoors
CaratLane Cara Cluster Gold Diamond 18 K Ring,Jewelry
Teen Tees Graphic Print Men's Round Neck T-Shirt,Clothing
"TSG Breeze Casual Sleeveless, Short Sleeve Solid Women's Top",Clothing
Bebo Casual Full Sleeve Solid Women's Top,Clothing
Meish Casual Full Sleeve Embellished Women's Top,Clothing
Chkokko Party Short Sleeve Solid Women's Top,Clothing
"SFDS Casual, Party, Wedding 3/4 Sleeve Solid Women's Top",Clothing
Silver Streak Men's Printed Casual Shirt,Clothing
Yepme Full Sleeve Solid Men's Jacket,Clothing
Yepme Sleeveless Solid Men's Jacket,Clothing
Jahnavi'S Universe Casual Sleeveless Printed Women's Top,Clothing
Kaxiaa Casual Sleeveless Printed Women's Top,Clothing
Parinita Casual Sleeveless Printed Women's Top,Clothing
BlueStone Exquisite Tulip Rose Gold Diamond 14 K Ring,Jewelry
Divaat Women's Shift Dress,Clothing
Afamado Women's Shift Dress,Clothing
Divaat Women's Peplum Dress,Clothing
Darling Women's A-line Dress,Clothing
Pepito Full Sleeve Printed Boy's Sweatshirt,Clothing
Hypernation Casual Sleeveless Printed Women's Top,Clothing
Co.in Casual Sleeveless Printed Women's Top,Clothing
Wrangler Solid V-neck Casual Men's Sweater,Clothing
Okane Full Sleeve Solid Men's Jacket,Clothing
The Vanca Sleeveless Self Design Men's Jacket,Clothing
The Vanca Sleeveless Solid Men's Jacket,Clothing
NU9 Sleeveless Solid Men's Jacket,Clothing
Mr Button Full Sleeve Solid Men's Linen Jacket,Clothing
Rasav Jewels White Gold Diamond 18K White Gold 18 K Ring,Jewelry
Wajbee Casual Printed Women's Kurti,Clothing
WearYourShine by PCJ The Xaria Gold Diamond 18 K Ring,Jewelry
Calgari Casual Full Sleeve Printed Women's Top,Clothing
"One Femme Formal, Party, Wedding Full Sleeve Solid Women's Top",Clothing
"Stylestone Formal, Casual, Party 3/4 Sleeve Solid Women's Top",Clothing
Kaaryah Formal 3/4 Sleeve Solid Women's Top,Clothing
"One Femme Formal, Party Full Sleeve Solid Women's Top",Clothing
Craftter Elephant Square Wall Lamp,Tools & Home Improvement
Craftter Flying Butterfly Square Wall Lamp,Tools & Home Improvement
La Isla Women Heels,Clothing
Popnetic Casual Sleeveless Solid Women's Top,Clothing
Popnetic Casual Short Sleeve Solid Women's Top,Clothing
TeesTadka Casual Sleeveless Solid Women's Top,Clothing
Bhane Casual Sleeveless Solid Women's Top,Clothing
